News_ID,Date,Subject,Title,Summary,Body,Short_link
835587,۱۴۰۱/۰۱/۲۸,عمومی,مهدی کروبی در مراسم افطاری کرباسچی (فیلم),مهدی کروبی شب گذشته در مراسم افطاری در منزل غلامحسن کرباسچی به مناسبت میلاد امام حسن مجتبی (ع) شرکت کرد.,کد ویدیو  دانلود    فیلم اصلی                                     ,https://www.asriran.com/003VND
835588,۱۴۰۱/۰۱/۲۸,ورزشی,هیئت رئیسه فدراسیون فوتبال از رسمیت افتاد/مجمع همه‌کاره شد,در حال حاضر تنها ۷ عضو هیئت رئیسه امکان حضور در جلسات هیئت رئیسه را دارند؛ اما برای رسمیت پیدا کردن جلسات هیئت رئیسه، باید حدقل ۸ عضو در این جلسات حاضر شوند.,"با دستگیری یک عضو هیئت رئیسه فدراسیون فوتبال دیگر امکان برگزاری جلسات هیات رییسه وجود ندارد.
به گزارش ایرنا، اتفاقات عجیب فدراسیون فوتبال با دستگیری یکی از اعضای هیئت رئیسه این فدراسیون تکمیل شد. ۲۸ بهمن سال گذشته شهاب‌الدین عزیزی خادم با رای اکثریت اعضای هیئت رئیسه فدراسیون فوتبال از ریاست این فدراسیون برکنار و میرشاد ماجدی سرپرست فدراسیون فوتبال شد و از همان زمان حواشی که گریبانگیر این فدراسیون شده بود بیشتر هم شد.
در ادامه نایب رئیس فدراسیون فوتبال در نامه‌ای به کنفدراسیون فوتبال آسیا در خصوص وجاهت قانونی دو نایب رئیس اول و دوم فدراسیون از این کنفدراسیون استعلام کرد و کنفدراسیون فوتبال آسیا در پاسخ به این استعلام اعلام کرد که حضور دو نایب رئیس اول و دوم به دلیل اینکه منتخب مجمع نیستند و توسط رئیس معزول فدراسیون فوتبال منصوب شدند غیرقانونی است.
با توجه به همین موضوع و غیرقانونی بودن حضور نایب رئیس اول و دوم فدراسیون فوتبال و دستگیری نایب رئیس سوم این فدراسیون و همچنین عزل عزیزی خادم که به عنوان رئیس فدراسیون، عضو هیئت رئیسه این فدراسیون هم بود و در حال حاضر این سمت را بر عهده ندارد عملا این ۴ نفر دیگر نمی‌توانند در جلسات هیئت رئیسه شرکت کنند و با این اوصاف دیگر امکان برگزاری جلسات هیئت رئیسه فدراسیون فوتبال نیست؛ چرا که این جلسات با دو سوم اعضا رسمیت پیدا می‌کند و در حال حاضر تنها ۷ عضو هیئت رئیسه امکان حضور در جلسات هیئت رئیسه را دارند؛ اما برای رسمیت پیدا کردن جلسات هیئت رئیسه، باید حدقل ۸ عضو در این جلسات حاضر شوند.
در چنین شرایطی که امکان برگزاری جلسه هیئت رئیسه فدراسیون فوتبال وجود ندارد درخواست‌های اعضای مجمع باید توسط دبیرکل در مجمع دهم خرداد این فدراسیون طرح و در خصوص آن تصمیم‌گیری شود؛ مگر اینکه تا آن زمان مشکلی که برای نایب رئیس بازداشت شده فدراسیون به وجود آمده حل شود.                           ",https://www.asriran.com/003VNE
835586,۱۴۰۱/۰۱/۲۸,اجتماعی ,مهلت انتخاب رشته کنکور دکتری ۱۴۰۱ تمدید شد,در این آزمون ۱۸۶ هزار و ۵۵۶ نفر شرکت کردند و ۱۳۷ هزار و ۱۱۷ نفر مجاز به انتخاب رشته شدند.,"مهلت انتخاب رشته کنکور دکتری ۱۴۰۱ تا روز سه شنبه ۳۱ فروردین ماه در درگاه الکترونیکی سازمان سنجش آموزش کشور تمدید شد.
علیرضا کریمیان سخنگوی سازمان سنجش آموزش کشور در گفت و گو با خبرنگار علم و آموزش ایرنا، اظهار داشت: مهلت انتخاب رشته در آزمون دکتری ۱۴۰۱ که ساعت ۲۴ امشب به پایان می رسید تا روز سه شنبه ۳۱ فروردین ماه در درگاه الکترونیکی سازمان سنجش آموزش کشور به نشانی تمدید شد.
وی درباره آمار انتخاب رشته کنندگان گفت: تاکنون ۶۳ هزار نفر نسبت به تکمیل فرم انتخاب رشته اقدام کرده اند.
سخنگوی سازمان سنجش آموزش کشور خاطرنشان کرد: در این آزمون ۱۸۶ هزار و ۵۵۶ نفر شرکت کردند و ۱۳۷ هزار و ۱۱۷ نفر مجاز به انتخاب رشته شدند.
به گزارش ایرنا، ظرفیت پذیرش اعلامی در دانشگاه‌های وزارت علوم، تحقیقات و فناوری ۱۲ هزار و ۷۱۶ نفر و ظرفیت پذیرش اعلامی در دانشگاه آزاد اسلامی ۱۱ هزار و ۵۳۸ نفر است که در مجموع ۲۴ هزار و ۲۵۴ نفر پذیرفته می شوند.
داوطلبان مجاز به انتخاب رشته می‌توانند در ۲۴۷ کد رشته محل اعلام شده در دفترچه راهنما، نسبت به انتخاب ۵۰ رشته محل در صورت علاقه اقدام کنند.
اسامی معرفی‌شدگان دارای حدنصاب به منظور شرکت در مرحله دوم (مصاحبه، بررسی سوابق علمی و پژوهشی و ...) در دهه سوم اردیبهشت ماه ۱۴۰۱ از طریق درگاه اطلاع‌رسانی این سازمان منتشر می شود.
داوطلبانی که مجاز به انتخاب رشته و علاقه‌مند به انتخاب رشته‌های دانشگاه آزاد اسلامی هستند، لازم است به درگاه این دانشگاه به آدرس www.azmoon.org مراجعه و بر اساس اطلاعیه‌های مربوط که در درگاه آن دانشگاه اطلاع‌رسانی می شود، اقدام کنند.
کنکور دکتری سال ۱۴۰۱ دانشگاه ها و مراکز آموزش عالی روز جمعه ششم اسفندماه ۱۴۰۰ در ۹۶ شهر و ۱۸۹ حوزه اصلی با رعایت دستورالعمل های بهداشتی برگزار شد.
داوطلبان دکتری در گروه‌ های علوم انسانی، علوم پایه، فنی و مهندسی، هنر، دامپزشکی، کشاورزی و در ۲۴۷ رشته امتحانی شرکت کردند.                           ",https://www.asriran.com/003VNC
835584,۱۴۰۱/۰۱/۲۸,اقتصادی,درخواست کپی مدارک هویتی در بانک‌ها ادامه دارد/ بی‌توجهی بانک‌ها به بخشنامه بانک مرکزی,بارها اعلام شده که دریافت کپی مدارک در دستگاه‌های اجرایی و بانک‌ها خلاف قانون است و مردم می‌توانند در صورت مواجه با چنین درخواستی موضوع را به صورت تلفنی به بازرسی بانک مربوطه اطلاع دهند.,"بانک‌ها همچنان به بخشنامه بانک مرکزی مبنی بر ممنوعیت دریافت کپی مدارک هویتی توجهی ندارند و حتی بخشنامه‌های تاکیدی بانک مرکزی باعث نشده تا بانک‌ها از شهروندان درخواست کپی مدارک هویتی نکنند.
به گزارش ایرنا، پایش و بررسی اجرایی شدن بخشنامه بانک مرکزی که پیرو بخشنامه سازمان اداری و استخدامی کشور با موضوع ممنوعیت دریافت کپی مدارک هویتی، به کلیه بانک‌ها ابلاغ شده بود، نشان می‌دهد به طور میانگین تنها ۱۷ درصد از بانک‌های منتخب در این پایش، مفاد بخشنامه ممنوعیت دریافت کپی مدارک را رعایت کرده‌اند.
این پایش توسط عوامل اجرایی طرح مبنا از ۷۵۶ شعبه از شعبه‌های منتخب بانک‌های ملی، سپه، رفاه‌کارگران، کشاورزی، توسعه‌تعاون، صنعت‌ومعدن، مسکن، ملت، سامان، سینا، پارسیان، رسالت و مهر ایران در ۲۳ استان کشور انجام شده و نتایج نشان می‌دهد شعب بانک‌های دولتی ۱۳.۳ درصد، بانک‌های خصوصی ۱۴.۳ درصد و بانک‌های قرض الحسنه ۴۰ درصد، این بخشنامه را اجرا کردند.
سازمان اداری و استخدامی کشور در راستای استقرار دولت الکترونیک، طی بخشنامه‌ای دریافت کپی مدارک هویتی توسط دستگاه‌های اجرایی از خدمت گیرندگان را ممنوع کرده است و این موضوع توسط بانک مرکزی برای همه بانک‌ها بخشنامه شد.
حتی در سال ۱۳۹۹ بانک مرکزی بر اجرای مفاد بخشنامه قبلی خود و «پذیرش و جایگزینی استعلام الکترونیکی و حذف مستندات کاغذی معادل در افتتاح حساب، درخواست و دریافت تسهیلات، درخواست صدور و تحویل دسته‌چک» با صدور بخشنامه‌ای، تاکید کرد اما همچنان برخی بانک‌ها و مؤسسات اعتباری غیربانکی کماکان بر خلاف مفاد بخشنامه‌های یاد شده، از مردم مدارک هویتی درخواست می‌کنند.
بارها اعلام شده که دریافت کپی مدارک در دستگاه‌های اجرایی و بانک‌ها خلاف قانون است و مردم می‌توانند در صورت مواجه با چنین درخواستی موضوع را به صورت تلفنی به بازرسی بانک مربوطه اطلاع دهند.
به گزارش ایرنا، سازمان اداری و استخدامی کشور ۱۲ دی ماه بر ممنوعیت دریافت کپی مدارک احراز هویتی توسط بانک مرکزی، بانک‌ها و سازمان ثبت احوال تاکید کرده بود. پیش از این نیز سازمان اداری و استخدامی کشور در دو بخشنامه جداگانه در هفدهم شهریورماه ۹۹ و پنجم دی ماه ۹۶ همچنین در یک بخشنامه تاکیدی نهم اسفندماه ۹۹، دریافت کپی مدارک هویتی، از جمله شناسنامه و کارت ملی را از خدمت‌گیرندگان توسط دستگاه‌های اجرایی ممنوع کرده است.
بانک مرکزی در چهارم اسفندماه سال گذشته بانک‌ها را موظف کرد در ارائه خدمات پایه به اشخاص حقیقی ایرانی، با تطبیق مشخصات هویتی با اصل مدارک، به دریافت کد رهگیری از سامانه استعلام هویتی ثبت احوال اکتفا کرده و نیازی به دریافت کپی مدارک هویتی نیست.                           ",https://www.asriran.com/003VNA
835585,۱۴۰۱/۰۱/۲۸,اجتماعی ,زمان برگزاری تشییع شاعر آیینی,,,https://www.asriran.com/003VNB
835581,۱۴۰۱/۰۱/۲۸,ورزشی,جریمه سنگین یوفا در انتظار بارسلونا,یوفا اتفاقات رخ داده را تحت بررسی دارد و طبق ادعای اسپورت، به زودی بارسا را جریمه خواهد کرد. جریمه ای که قرار است سنگین باشد و احتمال برگزاری یک بازی یا بیشتر بدون تماشاگر در نوکمپ متصور است.,"بارسلونا به خاطر اتفاقات رخ داده در بازی برابر فرانکفورت، از سوی یوفا جریمه خواهد شد.
به گزارش ورزش سه، حواشی مربوط به بازی پنجشنبه شب بارسا و آینتراخت همچنان ادامه دارد. بارسا در شرایطی میزبان تیم آلمانی بود که تنها 5 هزار نفر از هواداران میهمان مجو ورود به نوکمپ را داشتند و طبق قوانین یوفا تنها به این تعدا هوادار بلیت تعلق گرفته بود اما بارسا تصورش را هم نمی کرد که بیش از 20 هزار نفر از اعضای رسمی باشگاه، بلیت خود را در بازار سیاه به دوست داران آینتراخت فروخته باشند تا جو ورزشگاه کاملا به سود میهمان شود.
بارسا که بازی رفت را 1-1 مساوی کرده بود در زمین خود و در ورزشگاهی که بسیاری از سکوهایش سفیدپوش بود، 2-3 شکست خورد و از لیگ اروپا کنار رفت. سران بارسا به شدت از این اتفاق خشمگین هستند و بلافاصله نیز قانونی تصویب شد که از این پس در بازی های اروپایی، هیچ بلیتی قابل فروش توسط اعضا نباشد.
یوفا اتفاقات رخ داده را تحت بررسی دارد و طبق ادعای اسپورت، به زودی بارسا را جریمه خواهد کرد. جریمه ای که قرار است سنگین باشد و احتمال برگزاری یک بازی یا بیشتر بدون تماشاگر در نوکمپ متصور است. در واقع علاوه بر جریمه مالی، بارسا احتمالا در یک یا تعداد بیشتری از بازی های اروپایی فصل بعد خود نمی تواند از حضور هوادارانش بهره ببرد. پرونده ای در این زمینه تشکیل شده و به زودی حکمش اعلام خواهد شد.                           ",https://www.asriran.com/003VN7
835579,۱۴۰۱/۰۱/۲۸,سرگرمی,تغییر عمیق طی 10 سال! (عکس),,,https://www.asriran.com/003VN5
835583,۱۴۰۱/۰۱/۲۸,حوادث,دستگیری فروشنده گاز اشک‌آور در تهران,با دستگیری متهم تعداد ۸۰ عدد گاز اشک آور و دیگر ادوات نظامی که متهم اقدام به فروش آن در فضای مجازی کرده بود، از مخفیگاه وی کشف شد.,"مأموران پلیس امنیت عمومی تهران بزرگ فردی را که اقدام به فروش تجهیزات از جمله گاز اشک آور و ادوات نظامی در فضای مجازی کرده بود، بازداشت کردند.
به گزارش ایسنا، مأموران پلیس امنیت عمومی تهران بزرگ درپی دریافت اخباری مبنی بر فروش تجهیزات و ادوات نظامی از جمله گاز اشک آور، دستبند، شوکر و ... در فضای مجازی رسیدگی به موضوع را در دستورکار خود قرار دادند. با آغاز رسیدگی به این موضوع مأموران متوجه شدند که این فرد تعدادی از این تجهیزات را دراختیار دارد و از این رو برای شناسایی و دستگیری وی وارد عمل شدند.
ماموران با استفاده از روش‌های پلیسی محل اختفا و هویت فروشنده این تجهیزات نظامی را شناسایی کردند و در ادامه هماهنگی‌های لازم با مقام قضایی انجام شده و مأاموران پس از اخذ مجوز با مخفیگاه این فرد در محله پامنار حاضر شده و او را در عملیاتی ضربتی دستگیر و به مقر انتظامی منتقل کردند.
با دستگیری متهم تعداد ۸۰ عدد گاز اشک آور و دیگر ادوات نظامی که متهم اقدام به فروش آن در فضای مجازی کرده بود، از مخفیگاه وی کشف شد. متهم نیز به جرم خود اعتراف کرد و پس از تشکیل پرونده برای ادامه روند رسیدگی به جرم روانه دادسرا شد.
مرکز اطلاع رسانی پلیس پایتخت با تایید این خبر اعلام کرد:‌ تحقیقات برای شناسایی دیگر افراد مرتبط با این فرد در حال انجام است. همچنین شهروندان باید بدانند که هرگونه خرید و فروش تجهیزات و ادوات نظامی ممنوع بوده و با آن برخورد خواهد شد.                           ",https://www.asriran.com/003VN9
