News_ID,Date,Subject,Title,Summary,Body,Short_link
835668,۱۴۰۱/۰۱/۲۸,فرهنگی/هنری,وزارت فرهنگ و ارشاد: تکذیب شایعه لغو کنسرت‌های موسیقی,معاون امور هنری وزارت فرهنگ و ارشاد اسلامی: مطابق رسم و سنت همه‌ساله کنسرت‌های موسیقی از نیمه ماه مبارک رمضان به‌سبب قرار گرفتن در ایام پرفیض شب‌های قدر تا عید سعید فطر هیچ زمانی شاهد برگزاری کنسرتی نخواهیم نبویم.,"معاون امور هنری وزارت فرهنگ و ارشاد اسلامی با تکذیب شایعه لغو کنسرت‌های موسیقی که در فضای مجازی منتشر شده است، گفت: عدم برگزاری کنسرت در نیمه دوم ماه رمضان به سبب ایام پرفیض قدر تا آستانه عید سعید فطر سنت همه ساله بوده است.
به‌ گزارش ایرنا، شامگاه ۲۸ فروردین ۱۴۰۱ مطلبی در فضای مجازی مبنی‌بر لغو تمامی کنسرت‌ها در کشور منتشر شد. در آن متن آمده بود که هیچ خواننده‌ای قبل از حذف آثارش از رادیو جوان و ملوبات اجازه برگزاری کنسرت در سال ۱۴۰۱ را نخواهد داشت.
محمود سالاری در گفت‌وگو با ایرنا محتوای آن توئیت در فضای مجازی را کذب محض دانست.
معاون امور هنری وزارت فرهنگ و ارشاد اسلامی تصریح کرد: مطابق رسم و سنت همه‌ساله کنسرت‌های موسیقی از نیمه ماه مبارک رمضان به‌سبب قرار گرفتن در ایام پرفیض شب‌های قدر تا عید سعید فطر هیچ زمانی شاهد برگزاری کنسرتی نخواهیم نبویم.
سالاری ادامه داد: مسلم است که به‌مناسبت عید سعید فطر و ایام بعد از آن بار دیگر روند اجرای کنسرت‌های موسیقی مطابق مجوزهای صادر شده ادامه خواهد داشت.
معاون امور هنری وزارت فرهنگ و ارشاد اسلامی با اشاره به اجرای کنسرت گروه ماکان بند طی شب گذشته (شنبه ۲۷ فروردین ماه) بر کذب بودن ادعای مطرح‌شده در فضای مجازی تاکید کرد.                           ",https://www.asriran.com/003VOW
835667,۱۴۰۱/۰۱/۲۸,سیاسی,قالیباف: وقتی خروج از برجام اتفاق افتاد حتی آب خوردنمان را هم به برجام گره زدیم/ فرصت خطا کردن نداریم/  فهرست بلندبالایی از مشکلات وجود دارد,امروز نیازمند جهاد تصمیم در مجلس و دولت هستیم تا بر مشکلات فائق آییم در غیر این صورت مشمول تذکر رهبری خواهیم شد. در مجلس کمر همت بستیم تا به دور از اختلافات تصمیم بگیریم و با رویکرد مشخص حرکت کنیم.,"رئیس مجلس شورای اسلامی تاکید کرد: تاخیر در تصمیم باعث تردید می‌شود و تردید موجب تغییر در تصمیم قبل خواهد شد بنابراین تاخیر و تردید و تغییر نباید دامن جبهه انقلاب را در تصمیمات شجاعانه بگیرد.
به گزارش ایرنا، محمدباقر قالیباف در نشست صمیمی نمایندگان مجلس با رئیس جمهور و اعضای هیات دولت، گفت: در روزهای اخیر رهبر معظم انقلاب نکات مهمی را در بعد اخلاقی و مسائل مهم توسعه بیان کردند. یکی از مهم ترین تذکراتی که ممکن است مشمول افراد حاضر در این جلسه شود این است که ممکن است در روز قیامت برای کارهای نکرده از ما سوال کنند، لذا هر لحظه غفلت ما ممکن است به عظمت اسلام و مسلمین یا رزق و روزی و عمر مردم و یا ثمره انقلاب اسلامی آسیب بزند.
رئیس مجلس شورای اسلامی افزود: ما نباید فرصت ها را از دست دهیم زیرا این فرصت ها قابل تکرار نیست. روزی در این کشور ۱۱۹ میلیارد دلار در سال درآمد داشتیم و در دوره ای هم به جهت تحریم ها برای ۱۰ میلیارد دلار درآمد در سال تلاش می کردیم امروزه می فهمیم که با ۱۱۹ میلیارد دلار چه کارها و اقداماتی می توانستیم بکنیم که نکردیم. ما باید توجه داشته باشیم که این اتفاقات تکرار شدنی نیستند.
وی در ادامه اظهار کرد: در دولت گذشته در دوره ای منتظر مذاکرات، احیای برجام و اجرای آن ماندیم، وقتی هم که خروج از برجام اتفاق افتاد ما مسائل مختلف حتی آب خوردنمان را هم به برجام گره زدیم. آن دوران باید برای ما درس عبرت شود و در کنار پیگیری مذاکرات و رفع تحریم ها که دغدغه ما است، مسائل کشور را بدون توجه به برجام دنبال کنیم.
رئیس قوه مقننه یادآور شد: مسائل مذکور سبب شده کوچک‌ترین بحثی در مذاکرات در نرخ ارز یا خودرو تاثیراتی ایجاد کند لذا برای پرهیز از تخلفات و اشتباهات گذشته و شرایطی که اقتصادمان را شرطی کرده بودند باید از تکرار مجدد آن ها جلوگیری کنیم و در واقع ما فرصت خطا کردن نداریم. مجموعه جبهه انقلاب که در مسند مسوولیت و قدرت قرار گرفته محکوم به موفقیت است بنابراین مجلس و دولت و قوه قضائیه مجزا از یکدیگر نیستند و ما یکپارچه هستیم و مردم از ما چنین انتظار دارند.
قالیباف تصریح کرد: ما باید برای ساخت ایران قوی تلاش کنیم لذا به تصمیمات مهم نیاز داریم در حقیقت مسائل ما روشن و راهکارها مشخص است. عوارض احتمالی هم وجود دارد. قطعا محاسنی هم در این زمینه وجود خواهد داشت، در چنین شرایطی تاخیر در تصمیم باعث تردید می شود و تردید موجب تغییر در تصمیم قبل خواهد شد بنابراین تاخیر و تردید و تغییر نباید دامن جبهه انقلاب را در تصمیمات شجاعانه بگیرد.
وی افزود: فهرست بلندبالایی از مشکلات وجود دارد و ما باید اولویت ها را مشخص کنیم و جسارت داشته باشیم و با درایت و همدلی به سمت هم افزایی حرکت کنیم.
رئیس مجلس شورای اسلامی یادآور شد: امروز نیازمند جهاد تصمیم در مجلس و دولت هستیم تا بر مشکلات فائق آییم در غیر این صورت مشمول تذکر رهبری خواهیم شد. جهاد تصمیم به این معنا است که پس از مشورت، کار کارشناسی و بحث و جدل جمع بندی کنیم و سپس با اراده و محکم کار را براساس جمع بندی صورت گرفته انجام دهیم و از تهدید داخلی و خارجی و جوسازی های رسانه ای احساس نگرانی نکنیم. ما باید کار را با اخلاص و طبق سنت های الهی آغاز کنیم.
قالیباف با بیان اینکه هرچه پیش روی ماست فرصت است، گفت: فرصت ها دو نوع هستند فرصت های باریسک و فرصت‌های بدون ریسک که در کارهای انقلابی مبتنی بر عقلانیت و باورهای دینی باید فرصت های با ریسک را انتخاب کنیم زیرا آن‌ها می توانند تحولات بزرگی را رقم زنند.
رئیس قوه مقننه با بیان اینکه جهاد تصمیم رمز تبدیل فرصت های با ریسک به تحولات بزرگ در کشور است، گفت: در سال ۱۴۰۱ در آستانه تنظیم برنامه هفتم توسعه هستیم لذا باید اجازه دهیم تصمیمات شجاعانه گرفته شود چرا که با تصمیم های بزرگ می توانیم جراحی های بزرگ و تحولات بزرگی را ایجاد کنیم. ما در مجلس برای رقم زدن این حرکت مهم کمر همت بستیم تا به دور از اختلافات تصمیم بگیریم و با رویکرد مشخص حرکت کنیم. اختلافات سلیقه ای طبیعی است و اختلافاتی که منافع مردم و قانون را در نظر نگیرد ناپسند خواهد بود.                           ",https://www.asriran.com/003VOV
835666,۱۴۰۱/۰۱/۲۸,علمی,ضربه خورشید به عطارد با یک موج پلاسما,موج پلاسما از یک لکه خورشیدی می‌آید که مناطقی در خارج از خورشید هستند که در آن میدان‌های مغناطیسی قدرتمند توسط جریان بارهای الکتریکی ایجاد می‌شوند و قبل از اینکه ناگهان به هم بخورند، به یکدیگر گره می‌خورند. انرژی حاصل از این فرآیند برخورد، به شکل انفجارهای تابشی به نام شراره‌های خورشیدی یا امواج پلاسما(CME) آزاد می‌شود.,"فعالیت خورشید بسیار سریع‌تر از آنچه دانشمندان پیش‌بینی می‌کردند، در حال افزایش است.
به گزارش ایسنا و به نقل از اسپیس، یک موج پلاسمایی غول‌پیکر که از خورشید پرتاب شد، روز سه‌شنبه ۱۲ آوریل به عطارد برخورد کرده است و احتمالاً موجب ایجاد یک طوفان ژئومغناطیسی و پاک کردن مواد از سطح این سیاره شده است.
این فوران قدرتمند که به عنوان ""خروج جرم از تاج خورشیدی""(CME) شناخته می‌شود، در غروب ۱۱ آوریل از سمت دور خورشید ساطع شده و کمتر از یک روز طول کشیده تا به نزدیک‌ترین سیاره به ستاره ما برخورد کند، جایی که ممکن است یک اتمسفر موقت ایجاد کرده باشد و حتی موادی به دُم دنباله‌مانند عطارد اضافه کرده باشد.
""خروج جرم از تاج خورشیدی"" فورانِ پر جرم از باد خورشیدی و افزایش میدان‌های مغناطیسی است که از تاج خورشید بیرون می‌آید و در فضا منتشر می‌شود. خروج جرم از تاج خورشیدی معمولاً با دیگر پدیده‌های خورشیدی مانند شراره خورشیدی همراه است. این پدیده از مناطق فعال خورشید مانند لکه‌های گروهی خورشید برمی‌خیزد. در بیشینه، روزانه سه بار فوران جرم از تاج خورشید در قالب باد خورشیدی در فضا منتشر می‌شود که سرعت مافوق صوت معادل ۲۵۰ تا ۷۰۰ کیلومتر بر ثانیه دارند و این مقدار در کمینه به یک خروج در هر پنج روز می‌رسد.
پژوهش‌های جدید می‌گویند، پدیده بازاتصال مغناطیسی مسئول به وجود آمدن CME و شراره خورشیدی است. هنگامی که این پدیده رخ می‌دهد اجرام به سوی زمین حرکت می‌کنند و امواج شوک به وجود می‌آورند که توان این امواج در مقیاس تراوات برابر با یک تریلیون وات است که باعث طوفان ژئومغناطیسی می‌شود و مغناطیس‌کره را تحت تأثیر قرار می‌دهد.
موج پلاسما از یک لکه خورشیدی می‌آید که مناطقی در خارج از خورشید هستند که در آن میدان‌های مغناطیسی قدرتمند توسط جریان بارهای الکتریکی ایجاد می‌شوند و قبل از اینکه ناگهان به هم بخورند، به یکدیگر گره می‌خورند. انرژی حاصل از این فرآیند برخورد، به شکل انفجارهای تابشی به نام شراره‌های خورشیدی یا امواج پلاسما(CME) آزاد می‌شود.
در سیاراتی مانند زمین که دارای میدان‌های مغناطیسی قوی هستند، امواج پلاسما جذب می‌شوند و طوفان‌های ژئومغناطیسی قوی ایجاد می‌کنند. در طول این طوفان‌ها، میدان مغناطیسی زمین کمی توسط امواج ذرات پرانرژی فشرده می‌شود که از خطوط میدان مغناطیسی نزدیک قطب‌ها می‌گذرد و مولکول‌های موجود در جو را به هم می‌زند و انرژی را به شکل نور آزاد می‌کند تا شفق‌های قطبی رنگارنگ در آسمان شب ایجاد شود.
حرکات این ذرات باردار الکتریکی می‌تواند میدان‌های مغناطیسی را به اندازه کافی قوی القا کند که ماهواره‌ها را فلج کند و حتی به زمین سقوط دهد و دانشمندان هشدار داده‌اند که این طوفان‌های ژئومغناطیسی حتی می‌توانند اینترنت را قطع کنند.
با این حال، عطارد بر خلاف زمین، میدان مغناطیسی خیلی قدرتمندی ندارد. این واقعیت همراه با نزدیکی آن به جهش‌های پلاسمایی خورشید به این معنی است که مدتی طولانی است که از هرگونه جو دائمی محروم شده است. اتم‌هایی که روی عطارد باقی می‌مانند دائماً در فضا پخش می‌شوند و دنباله‌ای مانند دنباله‌دارها را از مواد پرتاب‌شده در پشت این سیاره تشکیل می‌دهند.
اما باد خورشیدی که جریان ثابت ذرات باردار و هسته‌های عناصری مانند هلیوم، کربن، نیتروژن، نئون و منیزیم از خورشید است و امواج کشندی ذرات ناشی از CME دائماً مقادیر کمی از اتم‌ها را در لایه نازک جو عطارد دوباره پر می‌کنند و به آن نوسان می‌دهند.
پیش از این دانشمندان مطمئن نبودند که آیا میدان مغناطیسی عطارد به اندازه کافی قوی هست که بتواند طوفان‌های ژئومغناطیسی را ایجاد کند. با این حال، تحقیقات منتشر شده در دو مقاله در مجلات Nature Communications و Science China Technological Sciences در ماه فوریه ثابت کرد که میدان مغناطیسی این سیاره در واقع به اندازه کافی قوی است.
مقاله اول نشان داد که عطارد دارای یک جریان حلقوی است که یک جریان دوناتی شکل از ذرات باردار است که در اطراف یک خط میدانی بین قطب‌های این سیاره جریان دارند و مقاله دوم به این اشاره کرد که این جریان حلقه‌ای قادر به ایجاد طوفان‌های ژئومغناطیسی است.
""هوی ژانگ"" یکی از نویسندگان هر دو مطالعه و استاد فیزیک فضایی در مؤسسه ژئوفیزیک دانشگاه ""آلاسکا فیربنکس"" در بیانیه‌ای گفت: فرآیندها کاملاً شبیه به اینجا روی زمین هستند. تفاوت اصلی در اندازه سیاره است و عطارد میدان مغناطیسی ضعیف‌تری دارد و تقریباً هیچ جوی ندارد.
به گفته مرکز پیش‌بینی هوای فضایی سازمان ملی اقیانوسی و جوی آمریکا، فعالیت خورشید بسیار سریع‌تر از پیش‌بینی‌های رسمی گذشته افزایش یافته است. خورشید در یک چرخه ۱۱ ساله بین اوج و حضیض حرکت می‌کند، اما از آنجایی که مکانیسمی که این چرخه خورشیدی را به پیش می‌برد به خوبی شناخته نشده است، پیش‌بینی طول و قدرت دقیق آن برای دانشمندان چالش برانگیز است.                           ",https://www.asriran.com/003VOU
835665,۱۴۰۱/۰۱/۲۸,سیاسی,برگزاری دادگاه مهرشاد سهیلی در شعبه ویژه اطفال/ وکیل: موکلم اتهامات را تکذیب کرد,عناوین اتهامی موکلم «تحصیل مال نامشروع» و «غصب عنوان» و «جعل سند» بوده است. در دفاع از موکلم گفتم که هرگز و در هیچ جا عنوانی برای خود قائل نشده و اگر دیگران او را با عناوینی مانند فرمانده یاد کردند مشمول غصب عنوان نمی شود.,"وکیل مدافع مهرشاد سهیلی می‌گوید یک جلسه دادگاه برای رسیدگی به اتهامات «تحصیل مال نامشروع» و «غصب عنوان» و «جعل سند» موکلش برگزار شده است.
عبدالصمد خرمشاهی در گفت‌وگو با ایسنا در این باره اظهار کرد: دادگاه مهرشاد سهیلی روز ۲۰ فروردین در شعبه ۱۱۰ دادگاه کیفری دو استان قم برگزار شد و از آنجا که موکلم زیر ۱۸ سال است دادگاهش در شعبه ۱۱۰ دادگاه کیفری قم که ویژه اطفال هم است برگزار شد. موکلم اتهامات را تکذیب کرد و گفت که اقداماتش همواره خیر و در جهت کمک به فقرا بوده است.
وی ادامه داد: عناوین اتهامی موکلم «تحصیل مال نامشروع» و «غصب عنوان» و «جعل سند» بوده است. در دفاع از موکلم گفتم که هرگز و در هیچ جا عنوانی برای خود قائل نشده و اگر دیگران او را با عناوینی مانند فرمانده یاد کردند مشمول غصب عنوان نمی شود.
خرمشاهی گفت: ایرادات شکلی و ماهوی پرونده را در دفاع از موکلم عنوان کردم و با اعلام ختم رسیدگی، رای پرونده طی روزهای آتی صادر خواهد شد.
ذبیح الله خداییان سخنگوی قوه قضاییه ۱۹ بهمن سال گذشته در نشست خبری در پاسخ به سوالی درباره بازداشت مهرشاد سهیلی و اینکه اتهامات او چیست؟ گفت: این شخص هنوز تحت تعقیب دادسرای عمومی و انقلاب قم است و با اعطای نیابت قضایی نسبت به دستگیری او اقدام شد و اتهامات متعددی متوجه این شخص است و با صدورقرار تامین بدلیل عجز از تودیع وثیقه در بازداشت است و چند نفر هم بعنوان مطنون و مطلع دعوت شدند ولی به غیر این شخص هنوز کسی بازداشت نیست.                           ",https://www.asriran.com/003VOT
835664,۱۴۰۱/۰۱/۲۸,اجتماعی ,زلزله ۴.۴ ریشتری در بهاباد استان یزد,شهرستان بهاباد و بافق از مناطق زلزله خیز استان یزد است که هر ساله چندین زمین لرزه با درجه کمتر از ۳ درجه در این مناطق استان اتفاق می افتد.,"زمین لرزه ای به بزرگی ۴.۴ ریشتر یکشنبه شب بخش هایی از شهرستان بهاباد را در شمال شرقی استان یزد لرزاند.
به گزارش ایرنا، بر اساس اعلام مرکز لرزه‌نگاری موسسه ژئوفیزیک دانشگاه تهران این زمین لرزه در ساعت ۲۲:۲۴:۰۳ یکشنبه، ۲۸ فروردین ۱۴۰۱ در عمق هفت کیلومتر زمین اتفاق افتاده است و محل وقوع این زمین لرزه در فاصله‌ ۵۰ کیلومتری بهاباد، ۵۱ کیلومتری بافق و ۶۱ کیلومتری ساغند در استان یزد قرار دارد.
شهرستان بهاباد و بافق از مناطق زلزله خیز استان یزد است که هر ساله چندین زمین لرزه با درجه کمتر از ۳ درجه در این مناطق استان اتفاق می افتد.
اخبار تکمیلی در ارتباط با خسارات این زمین لرزه متعاقبا منتشر می شود.
مرکز شهرستان بهاباد در فاصله حدود ۲۰۰ کیلومتر مرکز استان یزد قرار دارد.                           ",https://www.asriran.com/003VOS
