News_ID,Date,Subject,Title,Summary,Body,Short_link
835624,۱۴۰۱/۰۱/۲۸,سیاست خارجی,احضار کاردار سوئد در ایران در پی اهانت به قرآن در این کشور,کاردار سوئد در تهران در غیاب سفیر آن کشور توسط رییس اداره سوم غرب اروپای وزارت امور خارجه احضار شد.,"در پی حوادث چند روز اخیر در سوئد که با آتش زدن قرآن کریم توسط راسموس پالودن، رهبر یک فرقه راست افراطی در شهر لینکوپینگ همراه بود، کاردار سوئد در تهران در غیاب سفیر آن کشور توسط رییس اداره سوم غرب اروپای وزارت امور خارجه احضار و مراتب اعتراض شدید جمهوری اسلامی ایران نسبت به اقدام موهن فرد یاد شده که متاسفانه به بهانه آزادی بیان با حمایت پلیس سوئد صورت گرفت، به وی ابلاغ شد.
به گزارش ایسنا، رییس اداره سوم غرب اروپای وزارت امور خارجه ضمن محکوم کردن این اقدام هتاکانه در ماه مبارک‌ رمضان، مسئولیت دولت سوئد در این باره را متذکر گردید و خواستار اقدام فوری و قاطع دولت این کشور برای پایان بخشیدن به جسارت به ساحت قرآن کریم و تضمین عدم تکرار آن در آینده شد.
وی توهین به مقدسات بیش از دو میلیارد مسلمان جهان و جریحه دار کردن احساسات آنان را بدترین سوء استفاده متصور از آزادی بیان دانست و گفت این حادثه تاسف بار که تحت حفاظت پلیس سوئد انجام شده، تصویر سوئد را نزد مسلمانان جهان مخدوش می کند.
کاردار سوئد در پاسخ ضمن ابراز تاسف از وقوع این حادثه در کشورش، گفت مراتب را فورا به مقامات کشور متبوعش منتقل می کند.                           ",https://www.asriran.com/003VNo
835621,۱۴۰۱/۰۱/۲۸,اجتماعی ,رئیس سازمان تعزیرات:نیازی به احضار واحد صنفی متخلف در شعبه نیست,مردم به محض تماس با ۱۳۵، لینکی به صورت پیامک دریافت می‌کنند تا شکایات خود را ثبت کنند البته مردم حتماً باید فاکتور خرید خودشان و پروانه کسب واحد صنفی ر ا نیز بارگزاری کنند.,"معاون وزیر دادگستری و رئیس سازمان تعزیرات حکومتی در مراسم افتتاح سامانه برخط 135، گفت: با توجه به اصلاح آیین‌نامه نیازی به احضار واحد صنفی متخلف در شعبه نیست و به محض ارجاع شکایت به شعبه مورد نظر رسیدگی انجام شده و حکم صادر شده از طریق پیامک به واحد صنفی اعلام می‌شود. به گزارش اداره کل روابط عمومی و تشریفات سازمان تعزیرات حکومتی، نشست خبری افتتاح سامانه برخط (موبایلی) طرح و پیگیری شکایات تعزیرات سامانه 135 سازمان تعزیرات حکومتی، در محل این سازمان برگزار ‌شد.
احمد اصانلو در این مراسم اظهار داشت: در مدت ۲۰۰ روز فعالیت در سازمان تعزیرات حکومتی، هشت راهبرد طراحی شده که دو راهبرد از آنها مربوط به تسهیل دسترسی مردم و هوشمندسازی فرآیندهای تعزیرات بوده است و اقدامات خوبی در این راستا انجام شده است.
وی افزود: امروز در راستای رویکرد دولت مردمی و انقلابی سیزدهم و تاکید ریاست محترم جمهوری مبنی بر بیان شفاف، صریح و صادقانه با مردم به برخی چالش‌های سازمان تعزیرات حکومتی اشاره می‌کنم.
اصانلو یادآور شد: با تصویب قانون نظام صنفی در سال 1392 و قانون حمایت از حقوق مصرف‌کنندگان، از مجموع چهار حلقه رسیدگی به بازار یعنی نظارت، کشف تخلف، بازرسی و رسیدگی فقط حلقه رسیدگی به تخلف به سازمان تعزیرات محول شده است؛ در حالی که تا قبل از تصویب قانون نظام صنفی، وظیفه نظارت، بازرسی، کشف تخلف و رسیدگی به تخلف همه بر عهده سازمان تعزیرات حکومتی بود اما با تصویب این قوانین سه وظیفه ابتدایی برعهده بازرسان اتاق اصناف و سازمان صمت گذاشته شد اخیراً نیز با تصویب قانون انتزاع نظارت بر بخش کشاورزی به جهاد کشاورزی محول شده است و در نتیجه این واگذاری وظایف، ماهیت شبه قضایی تعزیرات تقویت شد.
وی تصریح کرد: اما انتظارات مردم و برخی نمایندگان از تعزیرات حکومتی منطبق بر وظایفی است که قبل از اصلاح قوانین و زمان داشتن 4 مأموریت نظارت، بازرسی، کشف تخلف و رسیدگی‌ را به عهده داشته است و بر همین اساس انفعال در بازار را منتسب به تعزیرات می‌کنند.
معاون وزیر دادگستری به دومین چالش سازمان تعزیرات حکومتی اشاره کرد و گفت: با اصلاح قانون نظام صنفی اساساً رسیدگی به برخی تخلفات از سازمان تعزیرات حکومتی سلب شده است به عنوان نمونه تخلفات با بیش از یک میلیون تومان جریمه به هیات صنفی محول شده است که تعزیرات یکی از اعضای این هیات است بنابراین تعزیرات امکان اقدام اساسی و اثرگذار را ندارد.
وی به کمبودها و کاستی‌های سازمان تعزیرات حکومتی اشاره کرد و گفت: اکنون ۴۹ درصد شهرستان‌ها اساساً فاقد اداره تعزیرات حکومتی هستند همچنین از مجموع ۲۸۰ شهرستان دارای اداره کل تعزیرات حکومتی، ۱۰۰ شهرستان فاقد رئیس شعبه و نیروی دفتری هستند.
اصانلو گفت: اکنون ۷۰ درصد اماکن تعزیرات در شهرستان‌ها، استیجاری است و به لحاظ امکانات حمل و نقل برای برگزاری گشت‌ها این شرایط میراث گذشتگان است و اکنون قرار است تعزیرات حکومتی با عده و عده‌ای که دارد اقدامات تحولی انجام دهد.
رئیس سازمان تعزیرات حکومتی افزود: همه اقدامات ما در مدت ۲۰۰ روز این بود که به دنبال جذب نیرو، تأسیس شعب و امکانات بودیم و اینها مصادیقی است از وضعیتی که دولت قبل برای ما بر جای گذاشته و گرانی‌های امروز و تورم موجود ناشی از تورمی است که مربوط به گذشته و دولت قبل است و از آنها به ما به ارث رسیده است.
اصانلو گفت: اکنون حدود ۳۲۰ رئیس شعبه در سراسر کشور داریم و در تهران ۴۵ شعبه فعال است و این روسای شعب قرار است به تخلفات بازاری، قاچاق و حوزه بهداشت رسیدگی کنند.
رئیس سازمان تعزیرات حکومتی درباره میزان پرونده‌های وارده به تعزیرات در مدت ۲۰۰ روز فعالیت دولت سیزدهم افزود: در این بازه زمانی، ۳۶۰ هزار و ۲۴۳ پرونده به تعزیرات حکومتی ارجاع شده که به ۳۴۶ هزار پرونده رسیدگی شده است.
وی ادامه داد: همچنین در این مدت ۱۴۲ هزار و ۵۴۷ گشت‌ مشترک با همکاری سایر نهادهای نظارتی برگزار شده و در نوروز ۵۵ هزار گشت‌ مشترک برای نظارت بر بازار داشتیم.
وی خاطرنشان کرد: فقط روسای شعبه می‌توانند در گشت‌ مشترک حضور داشته باشند و به پرونده‌ها رسیدگی کنند که این نشان‌دهنده کار جهادی آن‌ها است اما مگر با تعداد ۳۲۰ رئیس شعبه به چند واحد صنفی می‌توان رسیدگی کرد؟ بنابراین چاره‌ای نیست جز اینکه در کنار اصلاح ساختارها و جذب نیرو از فناوری‌های نوین استفاده کنیم‌.
معاون وزیر دادگستری با بیان اینکه قبل از به‌روزرسانی سامانه ۱۳۵ با محدودیت‌های آیین‌نامه‌ای روبرو شدیم که خوشبختانه آیین‌نامه توسط هیئت دولت اصلاح شد، افزود: قبل از اصلاح سامانه، دسترسی مردم به سازمان تعزیرات ساده نبود و امکان پیگیری شکایات هم وجود نداشت اما در سامانه جدید این مشکلات رفع شده و با رونمایی سامانه جدید قرار است به محض اینکه شکایات وارد سامانه شود به شعبه رسیدگی‌کننده ارجاع و همه اقدامات و رسیدگی‌ها از طریق پیامک به شاکی اطلاع داده شود.
اصانلو اظهار داشت: مردم به محض تماس با ۱۳۵، لینکی به صورت پیامک دریافت می‌کنند تا شکایات خود را ثبت کنند البته مردم حتماً باید فاکتور خرید خودشان و پروانه کسب واحد صنفی ر ا نیز بارگزاری کنند.
وی یادآور شد: براساس قانون نظام صنفی، پروانه کسب واحدهای صنفی باید در مکانی که قابل رؤیت برای مشتریان باشد نصب شود.
رئیس سازمان تعزیرات بیان کرد: با توجه به اصلاح آیین‌نامه نیازی به احضار واحد صنفی متخلف در شعبه نیست و به محض ارجاع شکایت به شعبه مورد نظر رسیدگی انجام شده و حکم صادر شده از طریق پیامک به واحد صنفی اعلام می‌شود و واحد صنفی اگر اعتراضی داشت می‌تواند تقاضای تجدیدنظر کند پس تفاوت ایجاد شده عدم نیاز به حضور واحد صنفی است.
برنامه ما در آینده این است باشگاه ناظرین مردمی را در همین سامانه ایجاد کنیم تا مردم بتوانند به عنوان بازرس ما به تنظیم بازار کمک کنند و قطعاً مشوقی هم برای مردم درنظر گرفته می‌شود در نهایت هدف اصلی ما این است که دست متخلفان و گرانفروشان را از جیب مردم کوتاه کنیم.
اصانلو گفت: در فاز بعدی این سامانه، باشگاه ناظران مردمی ایجاد می‌شود و از ظرفیت مردمی برای رسیدگی به بازار و تنظیم بازار بهره‌برداری خواهد شد و مشوق‌هایی در این راستا در نظر گرفته شده است.
رئیس سازمان تعزیرات حکومتی اظهار داشت: با استفاده از سامانه‌های نوین در نظارت بر بازار بنا داریم دست سودجویان را از جیب مردم کوتاه کنیم.
گفتنی است، در این مراسم معاون توسعه مدیریت و منابع، سرپرست معاونت اجتماعی و پیشگیری از وقوع تخلفات و جمعی از مدیران ستادی سازمان تعزیرات حکومتی حضور داشتند.                           ",https://www.asriran.com/003VNl
835622,۱۴۰۱/۰۱/۲۸,ورزشی,واکنش فردوسی‌پور به درخشش دوباره طارمی در پرتغال,,"به گزارش خبر ورزشی عادل فردوسی پور درباره موفقیتهای مهدی طارمی گفت:
به نظر من مهدی طاری از تاثیرگذارترین بازیکنان پورتو و لیگ پرتغال است و از موفقیت سیر نمی‌شود که همین مسئله خیلی مهم است و می‌تواند باعث حضور او در تیم‌های بزرگتر شود.
مهدی طارمی واقعاً ماهرانه پنالتی می‌گیرد و گلزن بسیار خوبی است.
هت‌تریک کردن در یکی از لیگ‌های خوب اروپایی کار بزرگی بود که مهدی طارمی انجام داد و امیدوارم درخشش این بازیکن تا رقابتهای جام جهانی و حتی در خود جام جهانی ادامه داشته باشد.                           ",https://www.asriran.com/003VNm
835620,۱۴۰۱/۰۱/۲۸,اقتصادی,آماده باش مديران سايپا براي توليد 650 هزار دستگاه خودرو در سال جاري/ مديران سايپا از مديريت كارخانه اي خارج شوند,يكي از موضوعاتي كه مديران گروه بايد به آن توجه كنند توليد اقتصادي است و همان گونه كه اواخر سال گذشته عنوان شد توليد اقتصادي خودروهاي كوييك و شاهين براي سال جاري دنبال خواهد شد,"مديرعامل گروه خودروسازي سايپا از مديران گروه اين مجموعه خواست كه براي توليد 650 هزار دستگاه خودرو براي سال جاري آماده شوند و تمام هم و غم خود را براي تحقق و اجرايي شدن 8 فرمان ابلاغ شده رئيس جمهور بگذارند.
به گزارش سايپانيوز، محمدعلي تيموري در نشست با مديران گروه خودروسازي سايپا از تك تك آنها خواست كه در راستاي تحقق 8 فرمان ابلاغ شده از سوي رئيس جمهور، آماده شوند و برنامه ريزي مناسبي داشته باشند تا در سال جاري، توليد هدف گذاري شده، محقق شود.
او با بيان اينكه تا پايان سال جاري خودروسازان بايستي يك ميليون و 650 هزار دستگاه خودرو توليد كنند و تحقق عدد كمتر قابل قبول نيست، گفت: ضرورت دارد مديران گروه خودروسازي سايپا در توليد 650 هزار دستگاه خودرو كه سهم اين مجموعه است به طور كامل مشاركت داشته باشند و برنامه ها به گونه اي تنظيم شود كه رشد توليد بيشتر از هدف گذاري ياد شده باشد.
مديرعامل گروه خودروسازي سايپا تصريح كرد: يكي از موضوعاتي كه مديران گروه بايد به آن توجه كنند توليد اقتصادي است و همان گونه كه اواخر سال گذشته عنوان شد توليد اقتصادي خودروهاي كوييك و شاهين براي سال جاري دنبال خواهد شد؛ براي اينكه توليد اقتصادي محقق شود تمام شركت هاي گروه بايد بتوانند از مديريت كارخانه اي خارج شوند و نقش مديرعامل داشته باشند.
او با بيان اينكه براي اولين بار و با هدف چابك سازي گروه خودروسازي سايپا، تمام اختيارات به شركت هاي گروه تفويض مي شود، تصريح كرد: مجموعه هايی كه در قالب هلدينگ هستند، بايد به سمت شركت داري حركت كنند و ديگر وابسته به سايپا نباشند، استقلال در تصميم گيري، عمل و مباحث مالي باعث خواهد شد كه گروه سريعتر به اهداف ترسيم شده و به خصوص 8 فرمان ابلاغ شده از سوي رئيس جمهور برسد.
مديرعامل گروه خودروسازي سايپا گفت: در سال جاري شركت هاي گروه خودروسازي سايپا به دو روش مورد ارزيابي قرار خواهند گرفت يك بخش مربوط به نظام طرح ريزي بودجه و ديگري نظام دانش بنيان شدن شركت ها است.
او با تاكيد بر اينكه گروه بايد به نظام بودجه ريزي تسلط داشته باشد و با تكيه به اين مهم برنامه ريزي كند، گفت: اگر شركت ها مديريت مالي درست داشته باشند و اعتبارات مناسب از بانك ها دريافت كنند، مي توان توليد بيش از 650 هزار دستگاه خودرو در سال جاري را دنبال كرد.
تيموري با بيان اينكه ضرورت دارد، شركت هاي گروه خودروسازي سايپا مشكلات و چالش هاي خود را با سهامداران حل و فصل كنند، افزود: مبحث ديگري كه از شركت هاي گروه مي خواهيم دانش بنيان شدن است، چرا كه اين موضوع معيار ارتقا است.
مديرعامل گروه خودروسازي سايپا با بيان اينكه فرآيند دانش بنيان شدن يك تا سه سال زمان مي برد و اين امر هيچ ايرادي ندارد، تصريح كرد: هر شركتي كه در اين مسير گام بردارد رشد مي كند و در درجه بندي مجموعه بسيار اهميت دارد در اين ميان اگر شركتي برنامه دانش بنيان نداشته باشد درجه اش قطعا تنزل خواهد يافت.                           ",https://www.asriran.com/003VNk
835613,۱۴۰۱/۰۱/۲۸,اقتصادی,"آغاز فروش فوری خودرو"" شاهین ""بدون قرعه كشي (+قیمت و جدول فروش)",فروش فوق العاده شاهين.جي از ساعت 10 صبح روز سه شنبه (30 فروردين ماه) آغاز مي شود و فرآيند ثبت نام تا تكميل ظرفيت ادامه دارد.,"سايپا در پاسخ به تعداد قابل توجه متقاضيان براي خريد خودرو اقتصادي شاهين، فروش فوق العاده اين محصول را از 30 فروردين ماه و بدون انجام قرعه كشي، آغاز مي كند.
به گزارش عصر ایران گروه خودروسازي سايپا اعلام کرد در راستاي آرامش بخشي به بازار خودرو و كاهش التهاب هاي موجود، عرضه خودرو شاهين بدون انجام قرعه كشي را آغاز مي كند.

فروش فوق العاده شاهين.جي از ساعت 10 صبح روز سه شنبه (30 فروردين ماه) آغاز مي شود و فرآيند ثبت نام تا تكميل ظرفيت ادامه دارد.
متقاضيان اين خودرو مي توانند با مراجعه به آدرس اینترنتی saipa.iranecar.com فرآیند ثبت نام در طرح مذکور را انجام دهند. بر این اساس زمان تحویل اين خودرو حداكثر90 روزه در نظر گرفته شده است و در صورت تاخير احتمالي در تحويل خودرو بر اساس قرارداد معادل 36 درصد سود سالانه (3درصد ماهانه) خسارت تاخير به صورت روز شمار محاسبه و پرداخت مي شود.
جدول فروش به شرح زیر است:
                           ",https://www.asriran.com/003VNd
835616,۱۴۰۱/۰۱/۲۸,سیاسی,درخواست برخی نمایندگان از رئیس جمهور برای حذف عوارض بر محصولات صادرات محور,با توجه به این وضعیت تعدادی از نمایندگان به موضوع عوارض بر محصولات صادرات محور واکنش نشان داده و از رئیس جمهور خواستند که به طور مستقیم ورود کند و جلوی ابلاغ و اجرای این بخشنامه را بگیرد.,"عضو ناظر مجلس در شورای عالی بورس وضع عوارض به محصولات صادرات محور را مغایر با سیاست های کلان اقتصاد مقاومتی دانست و گفت که تعدادی از نمایندگان از رئیس جمهور خواستار ورود به این موضوع شدند تا جلوی ابلاغ یا اجرای این بخشنامه گرفته شود.
محسن علیزاده در گفت وگو با ایسنا اظهار کرد: هفته گذشته بخشنامه ای توسط وزارت صنعت، معدن و تجارت درباره وضع عوارض به محصولات صادرات محور ابلاغ شد که بلافاصله با واکنش اهالی بازار سرمایه، سازمان بورس و اوراق بهادار مواجه شد.
وی ادامه داد: در این بخشنامه مقرر شده که محصولات تولیدی صادرات محور که بازار خارجی دارند عوارضی برای صادرات پرداخت کنند موضوعی که با سیاست های کلان اقتصاد مقاومتی مغایرت دارد و حتی می تواند آسیب جدی به بازار سرمایه وارد کند. دلیل توجیهی دوستان این است که به دلیل تنش در کشورهای روسیه و اوکراین این امکان وجود دارد که محصولاتی از جمله فولاد و سیمان در کشورها قیمت بالا داشته باشند و محصولات صادراتی ما نتواند نیاز داخل را تأمین کند و بیشتر صادر شود به همین دلیل عوارضی بر آن وضع کردند.
این عضو کمیسیون اقتصادی مجلس خاطر نشان کرد: به نظر می رسد این موضوع آسیبی به بازار سرمایه وارد کند. مثلا یکی از شرکت ها در طول یک سال گذشته بیش از هزار میلیارد از سود سهامداران را ضرر کرده است. با توجه به این وضعیت تعدادی از نمایندگان به موضوع عوارض بر محصولات صادرات محور واکنش نشان داده و از رئیس جمهور خواستند که به طور مستقیم ورود کند و جلوی ابلاغ و اجرای این بخشنامه را بگیرد.
علیزاده ادامه داد: هر چند دوستان در وزارت صمت اعلام کردند این بخشنامه کوتاه مدت و برای دو ماه اجرا می شود اما همین مدت هم آثار زیانبار خود را بر بازار سرمایه به جای می گذارد. مجلس از همه ابزارهای نظارتی خود برای کنترل بازار سرمایه استفاده می کند لذا مقرر شده جلساتی به همراه برخی از نمایندگان در کمیسیون اقتصادی و با حضور کارشناسان وزارت صمت تشکیل شده که هم دلایل توجهی آن ها با بشنویم و ما هم دلایل خود را برای لغو این مصوبه بیان کنیم.
وی در پایان گفت: ان شاءالله بعد از برگزاری این نشست دوستان در وزارت صمت متقاعد می شوند که این بخشنامه را لغو کنند.                           ",https://www.asriran.com/003VNg
