News_ID,Date,Subject,Title,Summary,Body,Short_link
835643,۱۴۰۱/۰۱/۲۸,اجتماعی ,اطلاعیه فرودگاه امام خمینی درباره نحوه پذیرش مسافر در روز ۲۹ فروردین ماه,هموطنان می‌توانند جهت اطلاع از زمان انجام امور پروازی خود به سایت www.ikac.ir مراجعه ویا با شماره‌تلفن ۰۲۱۵۱۰۰۱۱۸تماس حاصل کنند.,"نشست و برخاست هواپیماها در شهر فرودگاهی امام‌خمینی (ره) از ساعت ۰۷:۰۰ تا ۱۱:۳۰ روز دوشنبه ۲۹ فروردین انجام نمی‌شود، اما در این بازه زمانی کانترهای پذیرش مسافر فعال بوده و مسافرین پروازها پذیرش می‌شوند .
به گزارش ایرنا از روابط عمومی شرکت شهر فرودگاهی امام خمینی، نشست و برخاست هواپیماها در شهر فرودگاهی امام خمینی (ره) به مناسبت ۲۹ فروردین و مراسم رژه ارتش جمهوری اسلامی فردا دوشنبه از ساعت ۰۷:۰۰ تا ۱۱:۳۰ انجام نمی‌شود.
فرودگاه امام خمینی در این اطلاعیه آورده است: در آستانه فرارسیدن ۲۹ فروردین (روز ارتش) ضمن تبریک این روز به دلاورمردان ارتش جمهوری اسلامی ایرنا به اطلاع مسافرین می‌رساند با عنایت به برگزاری مراسم رژه نیروهای مسلح جمهوری اسلامی ایران در روز ۲۹ فروردین‌ماه در محل حرم مطهر امام خمینی (ره) در نزدیکی آزادراه تهران_ قم نشست و برخاست هواپیماها در شهر فرودگاهی امام‌خمینی (ره) از ساعت ۰۷:۰۰ تا ۱۱:۳۰ انجام نمی‌شود در این بازه زمانی کانترهای پذیرش مسافر فعال بوده و مسافرین پروازها پذیرش می شوند .
در این اطلاعیه آمده است: در این بازه زمانی بر اساس پیش‌بینی‌ها اتوبان تهران_ قم نیز بار ترافیکی سنگینی خواهد داشت از همه هموطنان، مسافران، کارکنان شرکت‌های هواپیمایی مستقر در فرودگاه و کرو پروازی درخواست می‌شود در روز دوشنبه ۲۹ فروردین‌ ماه ۱۴۰۱ ضمن اطمینان از ساعت دقیق پرواز از مسیرهای جایگزین برای رسیدن به شهر فرودگاهی امام خمینی (ره) استفاده کنند.
این اطلاعیه می افزاید: مسافران حداقل سه ساعت قبل‌ از ساعت پرواز در فرودگاه حضور داشته باشند.
هموطنان می‌توانند جهت اطلاع از زمان انجام امور پروازی خود به سایت www.ikac.ir مراجعه ویا با شماره‌تلفن ۰۲۱۵۱۰۰۱۱۸تماس حاصل کنند.                           ",https://www.asriran.com/003VO7
835642,۱۴۰۱/۰۱/۲۸,بین الملل,هشدار اورژانس آذربایجان‌شرقی نسبت به مصرف قارچ‌های طبیعی,تاکنون تعداد پنج نفر از مردم آذربایجان شرقی به دلیل مسمومیت ناشی از مصرف قارچ های سمی به مراکز درمانی و اورژانس مراجعه کرده اند.,"رئیس مرکز اورژانس پیش بیمارستانی و مدیریت حوادث دانشگاه علوم پزشکی تبریز نسبت به استفاده و مصرف قارچهای طبیعی خودرو هشدار داد.
به گزارش ایرنا؛ فرزاد رحمانی روز یکشنبه در جمع خبرنگاران با اشاره به بارش های اخیر در استان و رشد قارچ های سمی در دامن طبیعت، یادآور شد: در این شرایط، خانواده ها و والدین از کودکان خود باید مراقبت جدی نمایند تا از مصرف هرگونه قارچ خودرو در طبیعت، خودداری کنند.
وی به مهیا شدن شرایط رشد قارچ‌های خودرو در فصل بهار اشاره کرد و اظهار داشت: ابتدای هر سال با موجی از مسمومیت‌های اتفاقی ناشی از مصرف خوراکی قارچ‌های خودرو و سمی روبرو می‌شویم و تنها در سال ۱۳۹۶ بیش از یکهزار و ۵۴۰ مورد مراجعه به بیمارستان در اثر مسمومیت با مصرف قارچ‌های سمی در کشور گزارش شده است.
رحمانی ادامه داد: طبق اسناد موجود، مصرف خوراکی قارچ‌های خودرو و سمی منجر به فوت، نارسایی کبد و بستری شدن بسیاری از هموطنان و به خصوص ساکنان و گردشگران در مناطق کوهستانی و مرتعی شده است.
وی با بیان اینکه لزوم اطلاع رسانی در خصوص عدم خوراکی بودن قارچ‌های خودرو از سوی رسانه ها در زمان حاضر بسیار ضروری است، گفت: مردم باید از مصرف قارچ‌های خودرو به خصوص قارچ‌های جمع آوری شده توسط افراد بومی خودداری کرده و جهت حفظ سلامتی خود و خانواده تنها قارچ‌هایی را که توسط مراکز مجاز و در بسته بندی های دارای مجوز را خریداری و مصرف کنند.
رحمانی افزود: شناسایی انواع خوراکی قارچ از انواع سمی آن تنها بر اساس خصوصیات ظاهری مانند شکل، رنگ، بو، قوام و مزه مشکل بوده و توسط متخصصان و کارشناسان مجرب قارچ شناسی و گیاه‌شناسی امکان‌پذیر است و نباید به توصیه‌های برخی از افراد در تشخیص انواع سمی از انواع خوراکی قارچ توجه کرد.
به گفته وی تاکنون تعداد پنج نفر از مردم آذربایجان شرقی به دلیل مسمومیت ناشی از مصرف قارچ های سمی به مراکز درمانی و اورژانس مراجعه کرده اند.                           ",https://www.asriran.com/003VO6
835641,۱۴۰۱/۰۱/۲۸,اجتماعی ,جزئیات طرح ترافیک خبرنگاری/ رسانه‌ها درخواست خود را به مرکز ارتباطات ارسال کنند,فرآیند صدور مجوز طرح ترافیک خبرنگاری در سامانه تهران من پس از اعلام نهایی مرکز ارتباطات در خصوص سهمیه هر رسانه و اسامی خبرنگاران مجاز، توسط معاونت محترم حمل و نقل و ترافیک و به روال هرساله در سامانه تهران من صورت خواهد پذیرفت.,"سخنگو و رییس مرکز ارتباطات و امور بین‌الملل شهرداری تهران، درباره وضعیت مجوز ورود به طرح ترافیک و کارت بلیت خبرنگاران، گفت: با دستور شهردار تهران و با همراهی معاونت حمل و نقل و ترافیک، مسئولیت صدور مجوز طرح ترافیک و کارت بلیت خبرنگاری از امسال به مرکز ارتباطات و امور بین‌الملل شهرداری تهران واگذار شد.
به گزارش ایسنا، عبدالمطهر محمدخانی در این باره افزود: لازم است که رسانه‌های متقاضی، کلیه مکاتبات در این خصوص اعم از نامه‌های درخواست سهمیه طرح ترافیک و کارت بلیت خبرنگاران و لیست خبرنگاران مورد نظر خود را به مرکز ارتباطات و امور بین‌الملل شهرداری تهران ارسال کنند.
وی گفت: ثبت‌نام در سامانه تهران من و ارسال مدرک توسط خبرنگاران و روزنامه‌نگاران محترم در این سامانه به روال هرساله انجام می‌پذیرد و تغییری در این بخش صورت نگرفته است.
رئیس مرکز ارتباطات و امور بین الملل شهرداری پایتخت با اشاره به محدودیت‌ها و سقف مشخص صدور مجوز طرح ترافیک خبرنگاری، گفت: کمیته تسهیم مجوز طرح ترافیک در مرکز ارتباطات با حضور نماینده شورای شهر به عنوان عضو ناظر، نماینده معاونت حمل‌ونقل و ترافیک و نماینده معاونت مطبوعاتی وزارت ارشاد تشکیل خواهد شد تا نسبت به اختصاص سهمیه هر رسانه طبق شاخص‌های شفاف و تخصصی، اقدام شود.
وی با تأکید بر اینکه صدور مجوز طرح ترافیک خبرنگاری بر اساس اولویت حرفه‌ای رسانه‌ها و شاخص‌های استاندارد بررسی می‌شود، گفت: از جمله این شاخص‌ها می‌توان به قدمت و فراگیری رسانه، پرمخاطب بودن، تعدد سرویس‌های خبری، موضوعی و تخصصی و تعداد خبرنگاران رسمی و ثبت شده رسانه متقاضی در سامانه معاونت مطبوعاتی اشاره کرد.
محمدخانی در پایان افزود: فرآیند صدور مجوز طرح ترافیک خبرنگاری در سامانه تهران من پس از اعلام نهایی مرکز ارتباطات در خصوص سهمیه هر رسانه و اسامی خبرنگاران مجاز، توسط معاونت محترم حمل و نقل و ترافیک و به روال هرساله در سامانه تهران من صورت خواهد پذیرفت.
بر اساس گزارش سایت شهر، طبق اعلام معاونت حمل و نقل و ترافیک مهلت ثبت‌نام طرح ترافیک و کارت بلیت خبرنگاری تا ۱۰ اردیبهشت ۱۴۰۱ تمدید شده است.                           ",https://www.asriran.com/003VO5
835639,۱۴۰۱/۰۱/۲۸,بین الملل,در قرن صلح و آگاهی؛ جنایت جنگی و جنایت علیه بشریت چیست؟,کنوانسیون‌ها و مقررات بین المللی مختلفی در این خصوص در حقوق بین الملل وجود دارد که شامل کنواسیون‌های لاهه، اساسنامه رم (اساس تشکیل دادگاه بین المللی کیفری)، کنوانسیون ژنو و ... می‌شود.,"عصر ایران؛ ابوالفضل مجیدی* –  جنایت جنگی و نقض فاحش حقوق بشر به مجموعه اقداماتی گفته می‌شود که نقض قانون‌ها و آداب و رسوم جنگی باشد و رفتار‌های غیرمسالمت آمیز دولت‌ها با ملت‌ها باشد و در بیان ساده‌تر جنایت جنگی را کشتار هدفمند غیرنظامیان و تخریب عمدی اهداف غیرنظامی با بکارگیری سلاح جنگی اعم از تسلیحات ممنوعه، متعارف و غیر متعارف گفته می‌شود و جنایت علیه بشریت را کشتار و سرکوب هدفمند مردم غیرنظامی یک منطقه یا کشور گفته می‌شود. (جنایت نسل کشی؛ جنایات علیه بشریت؛ جرائم جنگی؛ جرم تجاوز.)
کنوانسیون‌ها و مقررات بین المللی مختلفی در این خصوص در حقوق بین الملل وجود دارد که شامل کنواسیون‌های لاهه، اساسنامه رم (اساس تشکیل دادگاه بین المللی کیفری)، کنوانسیون ژنو و ... می‌شود.
پایه و بنیان تشکیل سازمان ملل متحد، اساسنامه آن است که به تایید همه اعضای آن رسیده است. از مهمترین اصول و مقاصد ملل متحد طبق ماده ۱ آن؛ ""حفظ صلح و امنیت بین المللی و بدین منظور به عمل آوردن اقدامات دسته جمعی موثر برای جلوگیری و برطرف کردن تهدیدات علیه صلح و متوقف ساختن هرگونه عمل تجاوز یا سایر کار‌های ناقض صلح و... ""
همچنین طبق ماده ۲ منشور ملل متحد اعضا متعهد می‌شوند که ""کلیه اعضا در روابط بین المللی خود از تهدید به زور یا استفاده از آن علیه تمامیت ارضی یا استقلال سیاسی هر کشوری یا از هر روش دیگری که با مقاصد ملل متحد مغایرت داشته باشد خودداری می‌کند. "" و آنکه طبق بند ۷ ماده ۲ آن ""هیچ یک از مقررات مندرج در این منشور، ملل متحد را مجاز نمی‌دارد در اموری که ذاتا جزو صلاحیت‌های داخلی هر کشوری است دخالت کند و اعضا را نیز ملزم نمی‌کند که چنین موضوعاتی را تابع مقررات این منشور قرار دهند""
در شرایط عضویت کشور‌ها در سازمان ملل نیز بر این مهم تاکید گردیده است که کشور‌های شیفته صلح که تعهدات مندرج در این منشور را بپذیرند و به نظر و تشخیص سازمان قادر و مایل به اجرای آن باشند می‌توانند به عضویت ملل متحد درآیند. (بند ۱-۴ منشور ملل متحد) از سویی دیگر طبق ماده ۶ نیز ""هر عضو ملل متحد که در تخطی از اصول مندرج در این منشور اصرار ورزد ممکن است به وسیله مجمع عمومی بنابر توصیه شورای امنیت از سازمان اخراج گردد. ""
طبق بند یک ماده ۲۴ مسئولیت اعضای شورای امنیت سازمان ملل متحد تامین صلح و امنیت جهان است. ""به منظور تامین اقدام سریع و موثر از طرف ملل متحد اعضای آن مسئولیت اولیه حفظ صلح و امنیت بین‌المللی را به شورای امنیت واگذار می‌نمایند و موافقت می‌کنند که شورای امنیت در اجرای وظایفی که به موجب این مسئولیت بر عهده دارد از طرف آن‌ها اقدام نماید. ""
لذا اگر کشوری خود عضو سازمان ملل متحد باشد و مرتکب نقض مکرر مفاد منشور ملل متحد گردد که خود را پایبند به آن‌ها اعلام داشته است، در وهله اول اعتماد عمومی نسبت به وی سلب و ساقط می‌گردد، زیرا رفتار وی موید دو رویی و دورغگویی وی است و در وهله بعدی می‌بایست نسبت به برخورد لازم حقوقی و قانونی با آن اقدام گردد.
از سویی دیگر طبق مفاد کنوانسیون ژنو که مفادی را برای زمان جنگ وضع کرده‌است و از افرادی که دیگر در جنگ نیستند حفاظت و حمایت می‌کند تاکید گردیده است ""در جنگ نبایستی به افرادی که در جنگ شرکت نداشته‌اند یا مجروحان و کسانی که اسلحه خودرا به زمین گذاشته‌اند با تبعیض برخورد یا خلاف اصولی غیر از اصول انسانیت رفتار کرد و مورد تعدی و کشتار قرار داد. ""
کنوانسیون‌ها و معاهدات بین المللی مختلفی از جمله کنوانسیون راجع به ممنوعیت‌ها و محدودیت‌های کاربرد برخی از سلاح‌های متعارف با آثار و درد و رنج فراوان ۱۹۸۰، کنوانسیون ۱۹۷۲ خلع سلاح زیستی، پیمان منع استفاده از بمب‌های خوشه‌ای، اعلامیه جهانی حقوق بشر، میثاقین بین المللی حقوق مدنی و سیاسی و حقوق اقتصادی، اجتماعی و فرهنگی بیان کننده تعهدات دولت‌ها در قبال دیگر کشور‌ها و مردم خود است و تخطی از آن‌ها ابعاد مصداقی رفتار‌های مجرمانه جنایات جنگی و جنایت علیه بشریت می‌باشند و همگی بر عدم انجام رفتار‌های غیرمسالمت آمیز و سرکوب گرانه با بشریت و عدم بکارگیری از تسلیحات نظامی توسط کشور‌های متخاصم و متجاوز در جنگ‌ها خصوصا علیه غیرنظامیان و اهداف غیرنظامی تاکید و اصرار دارد؛ لذا آنچه مشخص است هر گونه اقدام و رفتاری که مشمول رفتار‌های مجرمانه فوق گردد از نظر جامعه جهانی و ملل متحد محکوم است و می‌بایست به اشد مجازات در قوانین بین المللی تعقیب و مجازات گردد.
تجاوز و حمله به خاک کشوری مستقل از سوی کشوری دیگر، کشتار غیرنظامیان، هدف قراردادن منازل مسکونی و کارخانه‌های صنعتی، ربودن اهالی و ساکنان محلی و منطقه ای، ساقط نمودن هواپیمای مسافری، سرکوب مستمر و هدفمند اعتراضات مسالمت آمیز و ... نیز از مصادیق رفتار‌های جنایت جنگی و جنایت علیه بشریت است.طبق مفاد اساسنامه رم مصوب ۱۹۹۸ میلادی که مبنی تشکیل دادگاه بین المللی کیفری می‌باشد؛ اساس و دغدغه تشکیل دادگاه مذکور طبق مقدمه آن بر مبنای زیر تشکیل گردید؛ 
""کشور‌های عضو اساسنامه با آگاهی از اینکه همه مردم با پیوند‌های مشترک متحد هستند، فرهنگ‌های آن‌ها در یک میراث مشترک جمع می‌شوند و نگران این هستند که این موزائیک ظریف ممکن است در هر زمان خرد شود، با توجه به اینکه در طول این قرن (قرن بیستم) میلیون‌ها کودک، زن و مرد قربانی قساوت‌های غیرقابل تصور شده اند که عمیقاً وجدان بشریت را شوکه می‌کنند، با درک اینکه این جنایات سنگین صلح، امنیت و رفاه جهان را تهدید می‌کند، با تأیید اینکه جدی‌ترین جنایات دغدغه جامعه جهانی به طور کلی نباید مجازات نماند و مجازات مؤثر آن‌ها باید با اتخاذ تدابیری در سطح ملی و تقویت همکاری‌های بین المللی تضمین شود، مصمم برای پایان دادن به مصونیت از مجازات عاملان این جنایات و در نتیجه مشارکت در پیشگیری از این جنایات، با یادآوری اینکه وظیفه هر کشور است که صلاحیت کیفری خود را نسبت به افراد مسئول جرایم بین المللی اعمال کند، با تأیید مجدد اهداف و اصول منشور سازمان ملل متحد، و بویژه اینکه همه کشور‌ها باید از تهدید یا استفاده از زور علیه تمامیت ارضی یا استقلال سیاسی هر کشور خودداری کنند، یا به هر روش دیگری مغایر با اهداف آن باشند.
سازمان ملل، در این رابطه با تأکید بر اینکه هیچ چیزی در این اساسنامه به منزله مجاز شدن هر کشور عضو برای مداخله در درگیری مسلحانه یا در امور داخلی هر کشوری نخواهد بود، با توجه به این اهداف و به خاطر نسل‌های فعلی و آینده، ایجاد یک دادگاه مستقل کیفری بین المللی دائم در رابطه با سیستم سازمان ملل متحد، با صلاحیت رسیدگی به جدی‌ترین جنایات مورد توجه جامعه جهانی به طور کلی، با تأکید بر اینکه دادگاه بین المللی جزایی که براساس این اساسنامه تأسیس شده است مکمل صلاحیت‌های کیفری ملی است مصمم است تا احترام ماندگار و اجرای عدالت بین المللی را تضمین کند""
در ماده ۵ اساسنامه مذکور اشاره‌ای به جرایم مهم بین الملل گردیده است که شامل جنایت نسل کشی؛ جنایات علیه بشریت؛ جرائم جنگی؛ جرم تجاوز می‌باشد.
جای تامل و سوال است که در قرنی که به عنوان صلح و دوستی و آگاهی بشریت است، رفتار‌هایی که منجر به وقوع جرایم جنگی و جرایم علیه بشریت گردد چه جایگاهی دارد؟ کدام ملت و مردمی هستند که با اینگونه رفتارها، همسو و همراه دولت‌های خود باشند؟ آیا مرز‌ها و تقسیم بندی‌های موجود بین المللی بعد از جنگ‌های جهانی و منازعات منطقه‌ای تثبیت نگردیده اند؟ مردم اراضی مختلف در اقصی نقاط جهان با توجه به شرایط موجود خود به دنبال رشد و پیشرفت کشور و منطقه خود هستند، آیا همچنان باید نگران رفتار‌های قرون وسطی و قرن جاهلیت بشریت باشند؟
برخورد با اقدامات خودسرانه و مغایر حقوق بین الملل و صلح جهانی از سوی مقامات و دولت‌های مجرم به جرایم بین المللی می‌بایست با جدیت در دستور کار نهاد‌ها و سازمان‌های بین المللی قرار گیرد و سازمان‌های مردم نهاد، رسانه‌ها و عموم مردم می‌بایست تعقیب متخلفان و مجرمان را از دولت‌ها و سازمان‌های بین المللی مطالبه نمایند تا جهانی عاری از رفتار‌های مجرمانه علیه بشریت برقرار گردد.
*نویسنده، حقوقدان و پژوهشگر حقوق بین الملل                           ",https://www.asriran.com/003VO3
