News_ID,Date,Subject,Title,Summary,Body,Short_link
834597,۱۴۰۱/۰۱/۲۲,بین الملل,وزیر خارجه روسیه: هدف از عملیات ویژه روسیه، پایان دادن به سلطه آمریکا بر جهان است,مسکو تسلیم فشارهای خارجی نمی شود، هدف از عملیات ویژه روسیه در اوکراین را خاتمه بخشیدین به برنامه های واشگتن برای سلطه جهانی برشمرد.,"سرگئی لاوروف وزیر امور خارجه روسیه روز دوشنبه هدف عملیات ویژه مسکو در اوکراین را پایان دادن به مسیر سلطه گری آمریکا بر جهان ذکر کرد.
به گزارش ایرنا به نقل از اسپوتنیک، دیپلمات ارشد روسیه سیاست های آمریکا و اروپا را مورد انتقاد قرار داد، در شرایطی که کشورهای غربی نسبت به ارسال سلاح به اوکراین متعهد شده اند.
وی با اعلام اینکه مسکو تسلیم فشارهای خارجی نمی شود، هدف از عملیات ویژه روسیه در اوکراین را خاتمه بخشیدین به برنامه های واشگتن برای سلطه جهانی برشمرد.
لاوروف گفت: عملیات نظامی ما برای پایان دادن به گسترش بی پروا و مسیر عاری از حس مسئولیت به سوی سلطه کامل آمریکا و به تبع آن بقیه کشورهای غربی در عرصه جهانی طراحی شده است.
وی افزود: این سلطه گری با نقض فاحش قوانین بین الملل ایجاد می شود و منطبق با برخی قوانین نامشخص است که در مواردی اعمال می شود.
وی همچنین از اتحادیه اروپا انتقاد کرد و گفت در حال حاضر قوانین به شدت تغییر کرده است.
لاوروف گفت: این یک تغییر کاملا جدی است حتی در سیاستی که اتحادیه اروپا و غرب تحت رهبری آمریکا پس از آغاز عملیات نظامی ویژه ما شروع به دنبال کردن آن کردند. سیاستی که منعکس کننده خشم و از جهاتی حتی دیوانگی است که البته نه صرفا به واسطه اوضاع اوکراین، بلکه با تبدیل کردن اوکراین به پایگاهی برای سرکوب نهایی روسیه تعیین می شود.
وزیر امور خارجه روسیه یادآور شد که این احتمال وجود دارد که نیروهای اوکراینی با حمایت سرویس های اطلاعاتی غربی اقدامات تحریک آمیز تازه ای انجام دهند.
وی به حوادث اخیر در دونباس اشاره داشت زمانی که نیروهای اوکراینی قصد داشتند روسیه را مسئول حملات شان به شهر کراماتورسک بدانند، اما به گفته لاوروف، پس از ارائه مدارکی از سوی روسیه در مورد این حادثه، رسوایی به طور کلی مخفی نگه داشته شد.
ولادیمیر پوتین رئیس جمهور روسیه روز ۲۱ فوریه ۲۰۲۲ (دوم اسفند ۱۴۰۰) با انتقاد از بی‌توجهی غرب به نگرانی‌های امنیتی مسکو، استقلال جمهوری‌های خلق دونتسک و لوگانسک را در منطقه دونباس به رسمیت شناخت.
پوتین سه روز پس از آن، پنجشنبه ۲۴ فوریه (۵ اسفند ۱۴۰۰) نیز عملیاتی نظامی که آن را ""عملیات ویژه"" خواند، علیه اوکراین آغاز کرد و به این ترتیب روابط پرتنش مسکو - کی‌یف به رویارویی نظامی تغییر وضعیت داد. درگیری‌ها در اوکراین و واکنش‌ها به اقدام روسیه همچنان ادامه دارد.                           ",https://www.asriran.com/003V7F
834596,۱۴۰۱/۰۱/۲۲,علمی,آمار چشمگیر مرگ و میر ناشی از کووید-۱۹ در افراد مبتلا به HIV,پژوهشگران آفریقای جنوبی در بررسی جدیدی نشان داده‌اند که مرگ و میر ناشی از کووید-۱۹ در افراد مبتلا به HIV سرکوب‌نشده، بالاتر از افرادی است که به این بیماری مبتلا نیستند.,"پژوهشگران آفریقای جنوبی در بررسی جدیدی نشان داده‌اند که مرگ و میر ناشی از کووید-۱۹ در افراد مبتلا به HIV سرکوب‌نشده، بالاتر از افرادی است که به این بیماری مبتلا نیستند.
به گزارش ایسنا و به نقل از نیوز مدیکال نت، دانشمندان به خاطر شیوع ""کروناویروس سندروم حاد تنفسی ۲""(SARS-CoV-2)، چندین مداخله دارویی و غیردارویی را برای مهار بیماری همه‌گیر کووید-۱۹ ایجاد کرده‌اند. به عنوان نمونه، توسعه سریع واکسن‌های کووید-۱۹، در پیشگیری از بیماری‌های شدید و مرگ و میر در سرتاسر جهان مؤثر بوده است.
در آفریقا به دلیل پوشش ضعیف واکسیناسیون، شدت عفونت و مرگ ناشی از ابتلا به کروناویروس همچنان بالا است. علاوه بر این، ظهور گونه‌های جدید کروناویروس، اثربخشی واکسن‌ها و داروهای موجود را که مبتنی بر پروتئین خوشه‌ای ویروس اصلی هستند، کاهش داده است. ""سازمان جهانی بهداشت""(WHO)، این گونه‌های کروناویروس را به عنوان ""گونه نگران‌کننده""(VOC) و ""گونه مورد توجه""(VOI) طبقه‌بندی کرده است.
HIV و کووید-۱۹
تأثیر کووید-۱۹ در بیماران مبتلا به ""ویروس نقص ایمنی انسانی""(HIV) مشخص نیست. پژوهشگران در یک پروژه انجام‌شده براساس مقیاس نمونه کوچک گزارش دادند که افراد مبتلا به HIV، نتایجی مشابه با افراد سالم نشان داده‌اند. با وجود این، یک بررسی همه‌گیرشناسی بزرگتر که در ""دانشگاه کوازولو ناتال""(UKZN) آفریقای جنوبی انجام شده، با نتایج گزارش قبلی در تناقض بوده و افزایش میزان بستری شدن و مرگ و میر ناشی از کووید-۱۹ را در میان افراد مبتلا به HIV در مقایسه با افراد HIV منفی شناسایی کرده است.
پژوهشی که پیشتر انجام شد، ظهور بسیاری از جهش‌ها را در افراد مبتلا به HIV پیشرفته نشان داد. پژوهشگران بیان کرده‌اند که سلول‌های B و سلول‌های T، نقش مهمی در محافظت در برابر ابتلا به کروناویروس بر عهده دارند. پژوهش‌ها نشان داده‌اند که واکنش سلول‌های T می‌تواند حتی در غیاب پاسخ‌های هومورال به محافظت بپردازد. این امر نشان می‌دهد که در شخصی با کمبودهای ارثی سلول B یا بدخیمی‌های خونی، سلول‌های T نقش مهمی در بهبود یافتن آنها از ابتلا به کروناویروس ایفا می‌کنند.
پژوهش‌های پیشین نشان داده‌اند که شدت کووید-۱۹ با ضعیف شدن پتانسیل عملکرد نوعی سلول T موسوم به ""+CD4"" در برخورد با کروناویروس مرتبط است. همچنین، چندین پژوهش نشان داده‌اند که واکسن‌های مبتنی بر ""آران‌ای پیام‌رسان""(mRNA) می‌توانند واکنش سلول‌های T موسوم به ""Th1"" و ""Th2"" را تحریک کنند. این امر می‌تواند با پادتن‌های خنثی‌کننده و واکنش سلول ""+CD8"" مرتبط باشد. بنابراین، دانشمندان به بینش‌های بیشتری در مورد محافظت به واسطه سلول‌های T در برابر کروناویروس نیاز دارند.
شیوع HIV در کشورهای جنوب صحرای آفریقا بالا است. بنابراین، تعیین میزان تأثیر HIV بر افراد مبتلا به کووید-۱۹ مهم است. درک پیامدهای بیماری در این جمعیت بیمار، به پژوهشگران و سیاستگذاران کمک می‌کند تا راهبردهای موثری را برای محافظت از مردم در برابر کروناویروس تدوین کنند.
یک پژوهش جدید، تأثیر ابتلا به HIV را بر کیفیت واکنش سلول T در برابر کروناویروس طی موج اول و دوم کووید-۱۹ در آفریقای جنوبی ارزیابی کرده است. پژوهشگران در این پروژه، واکنش سلول‌های +CD4 و +CD8 را در گروهی از افراد مبتلا به کروناویروس که مبتلا به HIV یا بدون آن بودند، بررسی کردند.
در این پژوهش، روش ""فلو سایتومتری""(Flow cytometry) برای تخمین زدن واکنش سلول‌های T به دنبال تحریک سلول‌های موسوم به ""PBMC"" با پپتید کروناویروس استفاده شد. همچنین پژوهشگران، به اندازه‌گیری سلسله مراتب سلطه‌ ایمنی سلول T پرداختند و امکان فرار کروناویروس از شناسایی سلول‌های T را تعیین کردند.
نخستین موج کووید-۱۹ در آفریقای جنوبی تحت سلطه جهش ""D614G"" بود؛ در حالی که موج دوم تحت سلطه سویه ""بتا""(Beta) آغاز شد. سلول‌های PBMC برای ارزیابی اثر عفونت HIV بر واکنش سلول T در برخورد با کروناویروس مورد استفاده قرار گرفتند.
اختلال در واکنش سلول T در برخورد با کروناویروس، در افراد مبتلا به HIV سرکوب‌نشده شناسایی شد. پژوهشگران، تعداد کمی از سلول‌های +CD4 را با فعال‌سازی بیش‌ایمنی مشاهده کردند که با کاهش واکنش سلول T در برابر کروناویروس مرتبط بود.
همچنین پژوهشگران، بروز جهش‌های خوشه‌ای را در سویه بتا تشخیص دادند که به عدم شناسایی سویه اصلی کروناویروس توسط سلول‌های T منجر شده بود. به همین ترتیب، واکنش ایمنی در برابر اپی‌توپ‌های سویه بتا نیز مانند اپی‌توپ‌های سویه اصلی کروناویروس شناسایی نشد. بنابراین این موضوع، توانایی برخی از گونه‌های کروناویروس را برای فرار از شناسایی سلول T نشان می‌دهد.
افراد مبتلا به HIV سرکوب‌نشده، واکنش ضعیفی را نسبت به کروناویروس نشان دادند. علاوه بر این، نقص‌های ایمنی ناشی از HIV مانند کاهش سلول‌های +CD4، افزایش بار ویروسی HIV و افزایش فعال‌سازی ایمنی، به کاهش واکنش در برابر کروناویروس منجر شد.
افراد بدون HIV در مقایسه با افراد مبتلا به آن، واکنش سلول +CD4 و +CD8 را در برابر پروتئین خوشه‌ای کروناویروس نشان دادند. علاوه بر این، کاهش تشخیص سلول T بین دو موج کووید-۱۹ مشاهده شد که برجسته‌تر بود.
عفونت سرکوب‌نشده HIV، واکنش سلول‌های T به کروناویروس را به طور قابل توجهی مختل می‌کند و امکان تشخیص سلول‌های T را کاهش می‌دهد. یافته‌های این پژوهش، افزایش آسیب‌پذیری افراد مبتلا به HIV در برابر کووید-۱۹ شدید را توضیح می‌دهند و همچنین، حساسیت آنها نسبت به گونه‌های در حال ظهور کروناویروس را برجسته می‌کنند.                           ",https://www.asriran.com/003V7E
834595,۱۴۰۱/۰۱/۲۲,ورزشی,روش عجیب انتقال بازیکن مصدوم پرسپولیس به بیمارستان (فیلم),نحوه انتقال فرشاد فرجی بازیکن مصدوم پرسپولیس در پایان بازی مقابل آلومینیوم یکی از حواشی این دیدار بود.,کد ویدیو  دانلود    فیلم اصلی                                     ,https://www.asriran.com/003V7D
834594,۱۴۰۱/۰۱/۲۲,بین الملل,"""شهباز شریف"" نخست وزیر جدید پاکستان شد",نمایندگان حزب تحریک انصاف به ریاست «عمران‌خان» جلسه رای گیری برای انتخاب نخست وزیر جدید را تحریم و اعلام کردند که همه نمایندگان حزب عمران‌خان قرار است از پارلمان ملی استعفا کنند.,"«محمد شهباز شریف» رئیس حزب مسلم لیگ نواز و نامزد مشترک جنبش دمکراتیک پاکستان امروز از سوی نمایندگان مجلس ملی این کشور به عنوان بیست و سومین نخست وزیر پاکستان انتخاب شد.
به گزارش خبرنگار ایرنا از صحن علی پارلمان پاکستان، نمایندگان مجلس در اسلام‌آباد با اکثریت آرا شهباز شریف فرد معرفی شده از سوی اعضای جنبش دمکراتیک شامل حزب مردم، مسلم لیگ نواز، جمعیت علمای اسلام، حزب ملی عوام، حزب عوامی بلوچستان، حزب جمهوری وطن و جنبش متحده قومی را برای تصدی مقام نخست وزیری این کشور انتخاب کردند.
گفتنی است، نمایندگان حزب تحریک انصاف به ریاست «عمران‌خان» جلسه رای گیری برای انتخاب نخست وزیر جدید را تحریم و اعلام کردند که همه نمایندگان حزب عمران‌خان قرار است از پارلمان ملی استعفا کنند.
نمایندگان پارلمان ملی پاکستان در حالی نخست وزیر جدید کشورشان را انتخاب کردند که بامداد روز گذشته پس از رای دیوان عالی پاکستان در لغو انحلال پارلمان و دولت وقت جلسه رای گیری برای طرح عدم اعتماد علیه عمران‌خان نخست وزیر سابق، برگزار شد و طی یک فرآیند پارلمانی عمران‌خان به عنوان بیست و دومین نخست وزیر از سمت خود برکنار شد.
بر این اساس، شهبازشریف برادر نواز شریف و سروزیر سابق ایالت پنجاب، با کسب ۱۷۴ رای به سمت بیست و سومین نخست وزیر پاکستان تعیین شد.

در رای گیری امروز پارلمان ملی، شهباز شریف و شاه محمود قریشی دو نامزد تصدی مقام نخست وزیری حضور داشتند. اما قریشی و دیگر نمایندگان حزب عمران‌خان پیش از آغاز رای گیری صحن مجلس را ترک کردند.
رسانه‌های پاکستان اعلام کردند: نخست وزیر جدید امروز در کاخ ریاست جمهوری (ایوان صدر) در مراسم سوگند شرکت می‌کند.
اعضای کابینه جدید پاکستان هم پس از معرفی پرویز شهباز شریف در کاخ ریاست جمهوری سوگند خواهند خورد. گفته می‌شود شهباز شریف علاوه بر انتخاب وزرای جدید از حزب خود قرار است چند وزیر را نیز از میان احزاب همپیمان خود شامل حزب مردم، جنبش متحده قومی، حزب ملی عوام و حزب عوامی بلوچستان معرفی کند.                           ",https://www.asriran.com/003V7C
834593,۱۴۰۱/۰۱/۲۲,اجتماعی ,پیک هفتم کرونا در مشهد آغاز شده است؟,در حال حاضر میزان آمار بستری مقداری بالا رفته است. البته تمام احتمالات به رفتار ویروس در چند روز آینده و اوایل هفته بعد وابسته است که مشخص شود آیا آمارها همچنان صعودی است یا افزایش آمار ناشی از ورود زائران است.,"رئیس دانشگاه علوم پزشکی مشهد در خصوص آغاز پیک هفتم کرونا در مشهد گفت: در خصوص پیک هفتم کرونا تمام احتمالات به رفتار ویروس در چند روز آینده و اوایل هفته بعد وابسته است که مشخص شود آیا آمارها همچنان صعودی است یا افزایش آمار ناشی از ورود زائران بوده است.
دکتر محمدعلی کیانی در گفت‌وگو با ایسنا در خصوص پیک هفتم کرونا بیان کرد: با توجه به جمعیت زائرانی که به شهر مشهد آمدند، نگرانی بابت پیک هفتم را داشته‌ و داریم. آمارها مقداری افزایش را نشان می‌دهد و منحنی‌های ما افزایشی است اما میزان مراجعه سرپایی ما از حالت افزایشی در حال رسیدن به حالت ثابت است و اگر همین روال در چند روز آینده باشد، می‌توان گفت که پیکی نخواهیم داشت.
وی ادامه داد: در حال حاضر میزان آمار بستری مقداری بالا رفته است. البته تمام احتمالات به رفتار ویروس در چند روز آینده و اوایل هفته بعد وابسته است که مشخص شود آیا آمارها همچنان صعودی است یا افزایش آمار ناشی از ورود زائران است.
رئیس دانشگاه علوم پزشکی مشهد در مورد بازگشایی مدارس و دانشگاه‌ها و خطر افزایش شیوع کرونا گفت: اکثر دانش‌آموزان و دانشجویان واکسینه شده‌اند و از این بابت مشکلی نداریم.
کیانی در خصوص شیوع سرخک عنوان کرد: شیوع سرخک در کشور ما به کشور افغانستان بازمی‌گردد که در آنجا هم شیوع پیدا کرده و این موضوع یک امر طبیعی است. وقتی که در کشورهای همسایه یک بیماری‌ شیوع پیدا می‌کند، به کشور ما نیز این موضوع می‌رسد و در اینجا نیز شایع می‌شود.
وی ادامه داد: همکاران ما بررسی‌های کاملی را ‌در این حوزه انجام داده‌اند. هم‌اکنون رصد، پایش، اطلاع‌رسانی و تمام فعالیت‌های بهداشتی مورد نیاز در حال انجام است.
رئیس دانشگاه علوم پزشکی مشهد گفت: توصیه ما این است که کودکان زیر پنج سال که واکسن سرخک نزده‌اند، هرچه سریع‌تر والدین‌شان برای واکسن اقدام کنند. واکسیناسیون می‌تواند در جلوگیری از شیوع بیشتر بسیار کمک‌کننده باشد.
کیانی ادامه داد: بیماری سرخک هم مسری است و هم می‌تواند کشنده باشد اما با تزریق واکسن جای هیچ نگرانی‌ نیست. سرخک برای افرادی که واکسن زده‌اند، مشکلی ایجاد نمی‌کند.
وی گفت: رعایت اصول بهداشتی، مراجعه به موقع به پزشکان و واکسیناسیون کودکان زیر پنج سال از مواردی است که می‌تواند از شیوع بیشتر سرخک جلوگیری کند.                           ",https://www.asriran.com/003V7B
