News_ID,Date,Subject,Title,Summary,Body,Short_link
834639,۱۴۰۱/۰۱/۲۲,سیاسی,رییس کل دادگستری: متهم پرونده حادثه حرم رضوی یک نفر است,طبق تحقیقات، متهم تحت تاثیر عقاید و جریانهای تکفیری بوده و محاربه، قتل عمد و ایراد صدمات با چاقو از اتهامات متهم است و دادگاه صالح برای رسیدگی به این پرونده دادگاه انقلاب است که پس از ارسال پرونده در شعبه ویژه مورد رسیدگی فوری قرار خواهد گرفت.,"رییس کل دادگستری خراسان رضوی گفت: پس از حادثه حرم رضوی و حمله به سه روحانی، مظنونانی احضار شده اند ولی در حد مباشرت، معاونت و حمایت از متهم دلیلی به دست نیامده و متهم پرونده یک نفر است.
به گزارش ایرنا؛ غلامعلی صادقی روز دوشنبه در گفت و گویی تلویزیونی اظهار کرد: پس از حادثه حرم رضوی دوربین های صحن مطهر در اختیار قرار گرفت و اظهارات شهود نیز کمک زیادی به این پرونده کرد، همچنین اظهارات متهم و برخی از مظنونان دستگیر شده در این حادثه نیز اخذ شده است.
وی خاطرنشان کرد: طبق تحقیقات، متهم تحت تاثیر عقاید و جریانهای تکفیری بوده و محاربه، قتل عمد و ایراد صدمات با چاقو از اتهامات متهم است و دادگاه صالح برای رسیدگی به این پرونده دادگاه انقلاب است که پس از ارسال پرونده در شعبه ویژه مورد رسیدگی فوری قرار خواهد گرفت.
رییس شورای قضایی خراسان رضوی در خصوص آشنایی متهم با سه روحانی مضروب نیز افزود: متهم در همان روز و قبل از حمله به سه روحانی به دو نفر روحانی دیگر نیز که در محیط بودند حمله کرده اما بنا به دلایلی موفق نشده بود لذا آشنایی قبلی بین متهم و این سه روحانی نبوده و به دلیل تفکرات تکفیری دست به این اقدام وحشیانه زده است.
وی درباره نحوه ورود سلاح سرد به حرم مطهر رضوی نیز گفت: متهم از طریق فضای مجازی آموزش‌هایی را در خصوص جاسازی سلاح در عملیات انتحاری دریافت کرده بوده است و با جاسازی ماهرانه سلاح را وارد حرم کرده بود.
رییس گل دادگستری خراسان رضوی افزود: در این حادثه ابتدا شهید دارایی و سپس شهید اصلانی مورد حمله قرار گرفته بودند و نفر سوم نیز حجت الاسلام پاکدامن بود که با ضربات چاقو مجروح شد و این سه اقدام کمتر از ۲ دقیقه صورت گرفته است.
صادقی خاطرنشان کرد: این حمله به این سه روحانی غافلگیرانه بود و طبق فیلم‌های موجود حرکت مشکوکی تا زمان حمله وجود نداشت.
وی اضافه کرد: پرونده دیگری نیز برای کسانی که در این حادثه کوتاهی و یا قصوری داشته‌اند تشکیل و در حال بررسی است.
به گزارش ایرنا، یک تروریست تکفیری روز سه‌شنبه ۱۶ فروردین ماه در صحن پیامبر اعظم (ص) حرم منور امام رضا(ع) با چاقو به سه روحانی حمله و آنان را به شدت مجروح کرد.
هر سه روحانی که در این حادثه مورد سوء قصد قرار گرفته بودند از فعالان جهادی و فرهنگی در مناطق حاشیه‌ای شهر مشهد بودند.
به دنبال این اقدام تروریستی حجت‌الاسلام محمد اصلانی، که برادر ۲ شهید بود، در همان لحظات اولیه به شهادت رسید و حجج اسلام پاکدامن و دارایی پس از انتقال به بیمارستان تحت درمان قرار گرفته و در بخش مراقبت‌های ویژه بستری شدند که سرانجام حجت الاسلام دارایی نیز عصر پنجشنبه گذشته بر اثر جراحات و صدمات وارده به شهادت رسید.
آیین تشییع حجت‌الاسلام اصلانی پنجشنبه گذشته با حضور گسترده اقشار مختلف مردم و مسوولان از میدان شهدا تا حرم مطهر رضوی برگزار شد و پیکر شهید دارایی نیز روز جمعه در مشهد تشییع شد که پیکر هر ۲ شهید در صحن جمهوری، در کنار شهدای انفجار تروریستی حرم مطهر رضوی در سال ۱۳۷۳ به خاک سپرده شدند.                           ",https://www.asriran.com/003V7v
834638,۱۴۰۱/۰۱/۲۲,بین الملل,یونیسف: نزدیک به دو سوم کودکان اوکراینی در ۶ هفته آواره شده‌اند,وضعیت کودکان در اوکراین در شهرهای ماریوپول و خرسون بدتر است. در این مناطق، کودکان و خانواده‌هایشان هفته‌ها است که بدون آب لوله‌کشی و سرویس‌های بهداشتی، عرضه منظم غذا و مراقبت‌های پزشکی به سر می‌برند. آنها در خانه ها و زیر زمین خود پناه گرفته اند و منتظر پایان بمباران و خشونت هستند.,"یک مقام صندوق کودکان سازمان ملل ( یونیسف) اعلام کرد نزدیک به دو سوم کودکان اوکراینی تنها در ۶ هفته آواره شده اند و نزدیک به نیمی از کودکانی که در اوکراین باقی مانده اند، ممکن است با ناامنی غذایی مواجه شوند.
به گزارش ایرنا؛ ""مانوئل فونتین"" مدیر امور اضطراری یونیسف روز دوشنبه به وقت محلی در نشست شورای امنیت سازمان ملل با موضوع حفظ صلح و امنیت اوکراین افزود: از ۳.۲ میلیون کودکی که تخمین زده می‌شود در اوکراین باقی مانده‌اند، نزدیک به نیمی از آنها ممکن است با خطر کمبود غذا مواجه باشند.
وی تصریح کرد حملات به زیرساخت های آب و برق باعث شده است که حدود ۱.۴ میلیون نفر در اوکراین به آب دسترسی نداشته باشند. ۴.۶ میلیون نفر دیگر فقط دسترسی محدودی به منابع آب تمیز دارند.
وی افزود: تنها در شش هفته، نزدیک به دو سوم کل کودکان اوکراینی آواره شده اند. آنها مجبور شده اند همه چیز از جمله خانه، مدارس، و اغلب اعضای خانواده خود را رها کنند.
فونتین ادامه داد: وضعیت کودکان در اوکراین در شهرهای ماریوپول و خرسون بدتر است. در این مناطق، کودکان و خانواده‌هایشان هفته‌ها است که بدون آب لوله‌کشی و سرویس‌های بهداشتی، عرضه منظم غذا و مراقبت‌های پزشکی به سر می‌برند. آنها در خانه ها و زیر زمین خود پناه گرفته اند و منتظر پایان بمباران و خشونت هستند.
مدیر امور اضطراری یونیسف همچنین از وجود مواد منفجره باقی مانده یا عمل نکرده که می تواند کودکان را در معرض مرگ و جراحت قرار دهد و همچنین اختلال در آموزش کودکان در سراسر اوکراین ابراز نگرانی کرد.
وی توضیح داد: تعطیلی مدارس در سراسر اوکراین بر یادگیری ۵.۷ میلیون کودک در سن مدرسه و ۱.۵ میلیون دانش آموز در آموزش عالی تأثیر می گذارد.
این مقام یونیسف اظهار داشت: در منطقه دونباس، یک نسل کامل از کودکان در طول هشت سال گذشته شاهد نابودی زندگی و تحصیلات خود بوده اند.
ولادیمیر پوتین رئیس جمهوری روسیه روز ۲۱ فوریه ۲۰۲۲ (دوم اسفند ۱۴۰۰) با انتقاد از بی‌توجهی غرب به نگرانی‌های امنیتی مسکو، استقلال جمهوری‌های خلق دونتسک و لوگانسک را در منطقه دونباس به رسمیت شناخت.
پوتین سه روز پس از آن، پنجشنبه ۲۴ فوریه (۵ اسفند ۱۴۰۰) نیز عملیاتی نظامی که آن را ""عملیات ویژه"" خواند، علیه اوکراین آغاز کرد و به این ترتیب روابط پرتنش مسکو - کی‌یف به رویارویی نظامی تغییر وضعیت داد. جنگ در اوکراین و واکنش‌ها به اقدام روسیه همچنان ادامه دارد.                           ",https://www.asriran.com/003V7u
834637,۱۴۰۱/۰۱/۲۲,اجتماعی ,کشف محموله بزرگ مواد مخدر شیشه توسط گمرک,امروز کارکنان و ماموران گمرک ماهیرود با توجه به حساسیت‌های اعلامی و آموزش‌های تخصصی، با احتمال جاسازی مواد مخدر در داخل تانکر حمل سوخت به رانندگی تبعه افغانستانی، بررسی از این کشنده و تانکر سوخت را در دستور کار قرار دادند و متوجه جاسازی حرفه‌ای مواد در داخل تانکر خالی می‌شوند.,"معاون گمرک ایران گفت: محموله ۵۷۰ کیلوگرمی مخدر شیشه که به صورت کاملا حرفه‌ای در جداره تانکر حمل سوخت افغانستانی جاسازی‌شده بود توسط مامورین گمرک ماهیرود در استان خراسان جنوبی کشف شد.
به گزارش ایرنا، فریده زبیدی معاون حقوقی و نظارت گمرک جمهوری اسلامی ایران اظهار داشت: در راستای بالا رفتن حساسیت از حیث احتمال افزایش جاسازی‌های حرفه‌ای مواد مخدر، لزوم تقویت گمرکات مرزهای شرقی، در دستور کار گمرک جمهوری اسلامی ایران قرار گرفته و اخیراً اقدامات قابل توجهی در زمینه تهیه و استقرار دستگاه‌های ایکس ری و افزایش تعداد سگ‌های مواد یاب انجام‌شده است.
وی افزود: امروز کارکنان و ماموران گمرک ماهیرود با توجه به حساسیت‌های اعلامی و آموزش‌های تخصصی، با احتمال جاسازی مواد مخدر در داخل تانکر حمل سوخت به رانندگی تبعه افغانستانی، بررسی از این کشنده و تانکر سوخت را در دستور کار قرار دادند و متوجه جاسازی حرفه‌ای مواد در داخل تانکر خالی می‌شوند.
زبیدی در ادامه گفت: با همکاری بخش‌های مختلف گمرک ماهیرود و هماهنگی با ستاد گمرک ایران، بدنه تانکر حمل سوخت با برش‌های تخصصی مورد کنترل قرار می‌گیرد و درمجموع ۵۷۰ بسته یک کیلوگرمی معادل ۵۷۰ کیلوگرم ماده مخدر مت‌آمفتامین (شیشه) کشف می‌شود.
معاون حقوقی و نظارت گمرک افزود: پس از هماهنگی با مرجع محترم قضایی و تنظیم صورت‌جلسه کشف، مواد مخدر مکشوفه توزین و همراه با متهم و تانکر مربوطه به نمایندگان پلیس مبارزه با مواد مخدر تحویل شد.
زبیدی در ادامه با اشاره به لزوم تجهیز مبادی رسمی کشور به دستگاه‌های ایکس ری و سگ‌های مواد یاب اعلام کرد: ساختار سازمانی گمرکات اجرایی کشور در حوزه مبارزه با مواد مخدر نیازمند اصلاح و بازنگری بوده و انشاالله در صورت به‌کارگیری نیروهای متخصص بیشتر، متعهد و آموزش دیده، نتایج مطلوب‌تری حاصل خواهد شد.
وی در پایان افزود: محموله ۵۷۰ کیلوگرمی شیشه کشف‌شده یکی از بزرگترین کشفیات گمرک بوده است.                           ",https://www.asriran.com/003V7t
834636,۱۴۰۱/۰۱/۲۲,بین الملل,مرگ ٧ نفر در عراق بە دلیل شیوع تب کریمه‌ کنگو,استان ذی‌قار در جنوب عراق قرار دارد و دارای ترکیب جمعیتی بالای روستایی و عشایری است. این استان به دلیل پرورش گاو، گوسفند، گاومیش و بز که همگی از ناقلان احتمالی تب خونریزی دهنده کریمه کنگو هستند، معروف است.,"مقامات بهداشتی استان ذی‌قارعراق اعلام کردند که از ابتدای سال گذشتە میلادی تا کنون ٧ نفر پس از تماس با دام‌ها بر اثر تب خونریزی‌دهنده کریمه کنگو جان خود را از دست دادەاند. وزارت بهداشت این کشور می‌گوید، موضوع در دست بررسی است.
به گزارش ایرنا، خبرگزاری فرانسه روز دوشنبه ۲۲ فروردین (۱۱ آوریل) به نقل از حسین ریاض، مدیر بهداشت عمومی استان ذی‌قار عراق نوشت: «در طول سال (میلادی) گذشته و ماه‌های اول سال جاری، ٧ مورد مرگ در استان ذی‌قار بر اثر تب خونریزی‌دهنده کریمه کنگو ثبت شدە است و هشتمین نفر نیز به شدت بیمار و بستری است.»
استان ذی‌قار در جنوب عراق قرار دارد و دارای ترکیب جمعیتی بالای روستایی و عشایری است. این استان به دلیل پرورش گاو، گوسفند، گاومیش و بز که همگی از ناقلان احتمالی تب خونریزی دهنده کریمه کنگو هستند، معروف است.
مدیر ادارە بهداشت عمومی ذی‌قار گفتە است، همه قربانیان در دامداری‌ها کار می‌کردند و آخرین مورد مرگ در آغاز سال ٢٠٢٢ ثبت شدە است.
به گفته سازمان بهداشت جهانی این بیماری از طریق کنه منتقل و باعث خونریزی شدید می‌شود. مردم اغلب پس از تماس با خون حیوانات آلوده، عموما پس از ذبح دام مبتلا می‌شوند.
این بیماری همچنین می‌تواند از طریق ""خون، ترشحات، اندام‌ها یا سایر مایعات بدن افراد آلوده"" بین انسان‌ها منتقل شود.
تب خونریزی‌دهنده کریمه کنگو در انسان بیماری شدیدی ایجاد می‌کند و شیوع بیمارستانی آن نیز بسیار بالا است و علائم آن تب بالا، دردهای عضلانی، سردردهای شدید و خونریزی عمومی در بدن است. بین ۱۰ تا ۴۰ درصد مبتلان جان خود را از دست می‌دهند.
به گفتە حسین ریاض تعداد دام‌های آلوده نامشخص است و دام‌ها احتمالا بدون انجام معاینات دامپزشکی از منطقه‌ای به منطقه دیگر منتقل شده‌اند.
سیف البدر، سخنگوی وزارت بهداشت عراق در گفت‌وگو با خبرگزاری فرانسه ضمن تائید این خبر اظهار داشت، این موضوع توسط مقامات بهداشتی این کشور در حال پیگیری است.
نام این بیماری ویروسی از مشاهده هم‌زمان آن در کریمه و کنگو گرفته شده است. تب کریمه کنگو واکسن ندارد، اما دارویی به نام ""ریباویرین"" که از آن برای درمان هپاتیت C نیز استفاده می‌شود، تا حدودی مرگ و میر بر اثر این بیماری را کاهش می‌دهد.                           ",https://www.asriran.com/003V7s
834635,۱۴۰۱/۰۱/۲۲,بین الملل,کرواسی ۱۸ دیپلمات روس را اخراج کرد,پیش از کرواسی کشورهای اروپایی لهستان، آلمان، فرانسه، ایتالیا، اسپانیا، دانمارک چندین دیپلمات روسیه را از کشورهایشان اخراج کرده بودند.,"وزارت خارجه کرواسی با انتشار بیانیه‌ای رسمی از اخراج دیپلمات‌های کشور روسیه در زاگرب خبر داد.
به گزارش ایرنا، وزارت امور خارجه کرواسی روز دوشنبه در بیانیه‌ای رسمی از اخراج ۱۸ دیپلمات کشور روسیه و ۶ کارمند اداری سفارت روسیه در زاگرب خبر داد.
در بیانیه این وزارتخانه آمده است: ۲۴ نفر از کارکنان سفارت روسیه در کرواسی شامل هجده دیپلمات و شش کارمند اداری با دستور رئیس جمهور کرواسی هر چه سریع‌تر باید این کشور را ترک کنند.
در این بیانیه همچنین آمده است: آندری نسترنکو، سفیر روسیه در زاگرب در اعتراض دولت کرواسی به اقدامات نظامیان روس در اوکراین به وزارت خارجه این کشور احضار شد.
پیش از کرواسی کشورهای اروپایی لهستان، آلمان، فرانسه، ایتالیا، اسپانیا، دانمارک چندین دیپلمات روسیه را از کشورهایشان اخراج کرده بودند.
از زمان آغاز جنگ روسیه علیه اوکراین در ۲۴ فوریه، حدود ۳۸۲ دیپلمات روسی از کشورهای اروپایی اخراج شده‌اند.                           ",https://www.asriran.com/003V7r
834634,۱۴۰۱/۰۱/۲۲,بین الملل,پنتاگون: روسیه درحال انتقال نیروهایش به دونباس برای تجدید و تقویت آنها است,ولادیمیر پوتین رئیس جمهوری روسیه روز ۲۱ فوریه ۲۰۲۲ (دوم اسفند ۱۴۰۰) با انتقاد از بی‌توجهی غرب به نگرانی‌های امنیتی مسکو، استقلال جمهوری‌های خلق دونتسک و لوگانسک را در منطقه دونباس به رسمیت شناخت.,"یک مقام وزارت دفاع آمریکا (پنتاگون) اعلام کرد که حرکت کاروان ارتش روسیه به سمت دونباس از طریق شهر ایزوم واقع در شمال اوکراین نشان می دهد که روسیه به دنبال تجدید و تقویت نیروهای خود در دونباس است.
به گزارش ایرنا؛ این مقام ارشد دفاعی آمریکا روز دوشنبه به وقت محلی به خبرنگاران گفت که کاروان نظامی روسیه شامل بخش فرماندهی و کنترل، یک گردان پشتیبانی، تامین کننده ها، پشتیبانی هوانوردی و سایر پشتیبانی های پیاده نظام است.
این مقام همچنین گفت شواهد موجود نشان می دهد که روسیه در تلاش است تا موقعیت خود را در جنوب غربی شهر دونتسک عمدتاً با واحدهای توپخانه تقویت کند.
به گفته این مقام، طبق ارزیابی های آمریکا، حرکت کاروان روسیه یک ""حمله جدید"" در دونباس نیست، بلکه نیروهای روسیه در تلاش برای تقویت توانایی های خود و افزودن به آن هستند.
ولادیمیر پوتین رئیس جمهوری روسیه روز ۲۱ فوریه ۲۰۲۲ (دوم اسفند ۱۴۰۰) با انتقاد از بی‌توجهی غرب به نگرانی‌های امنیتی مسکو، استقلال جمهوری‌های خلق دونتسک و لوگانسک را در منطقه دونباس به رسمیت شناخت.
پوتین سه روز پس از آن، پنجشنبه ۲۴ فوریه (۵ اسفند ۱۴۰۰) نیز عملیاتی نظامی که آن را ""عملیات ویژه"" خواند، علیه اوکراین آغاز کرد و به این ترتیب روابط پرتنش مسکو - کی‌یف به رویارویی نظامی تغییر وضعیت داد. جنگ در اوکراین و واکنش‌ها به اقدام روسیه همچنان ادامه دارد.                           ",https://www.asriran.com/003V7q
