News_ID,Date,Subject,Title,Summary,Body,Short_link
834835,۱۴۰۱/۰۱/۲۴,اجتماعی ,اعلام هشدار نارنجی هواشناسی در تهران/ فعالیت ورزشی دانش‌آموزان ممنوع,توصیه می شود بیماران قلبی، ریوی، سالخوردگان و کودکان حتی الامکان از قرارگیری در فضای باز و مواجهه با هوای ناسالم پرهیز کنند.,"معاون عمرانی استاندار تهران گفت: فعالیت های ورزشی و حضور کودکان و نوجوانان و دانش آموزان در حیاط و فضای باز در روز چهارشنبه ممنوع است.
به گزارش ایرنا از استانداری تهران، عابد ملکی در این باره گفت: مطابق اعلام وضعیت هشدار نارنجی از سوی سازمان هواشناسی مبنی بر وضعیت باد شدید در سطح استان تهران برای غروب سه شنبه و روز چهار شنبه و احتمال پدیده گرد و غبار و بالا رفتن شاخص آلودگی هوا، کمیته اضطرار آلودگی هوای استان تهران با حضور همه اعضاء بعد از ظهر روز سه شنبه ۲۳ فروردین تشکیل جلسه داد.
وی ادامه داد: در این جلسه پس از بررسی تصاویر ماهواره ای و گزارش سازمان هواشناسی در روز چهارشنبه، وضعیت ناسالم برای گروه های حساس پیش بینی شد، بنابراین ضمن اعلام هشدار نارنجی به هم استانی های عزیز مقرر شد که فعالیت های ورزشی و حضور کودکان، نوجوانان و دانش آموزان در فضای باز و فعالیت بدنی آن ها ممنوع باشد.
خودداری بیماران قلبی، ریوی و سالخوردگان از حضور در فضای باز
ملکی با اشاره به توصیه های انجام شده به شهروندان در این جلسه اظهار داشت: توصیه می شود بیماران قلبی، ریوی، سالخوردگان و کودکان حتی الامکان از قرارگیری در فضای باز و مواجهه با هوای ناسالم پرهیز کنند.
معاون هماهنگی امور عمرانی استانداری تهران افزود: ضمنا با توجه به وزش باد شدید از شهروندان تقاضا دارم که حداکثر مراقبت لازم را انجام دهند.                           ",https://www.asriran.com/003VB5
834834,۱۴۰۱/۰۱/۲۴,حوادث,فرودگاه اضطراری پرواز کیش- تهران در اصفهان به دلیل نقض فنی,مدیرکل بحران استانداری اصفهان با اشاره به اینکه فرودگاه اصفهان، جانشین فرودگاه تهران در حوادث و سوانح تعیین شده است افزود: خوشبختانه این حادثه مصدومی نداشت.,"مدیر کل بحران استانداری اصفهان از فرود اضطراری پرواز کیش به مقصد تهران در فرودگاه اصفهان به علت نقض فنی در یکی از موتورها خبر داد.
منصور شیشه فروش شبانگاه چهارشنبه در گفت و گو با ایرنا گفت: هواپیمای آتا، بوئینگ ۸۳ پرواز کیش به مقصد تهران با ۱۷۴ مسافر به علت نقص فنی یکی از موتور ها، وضعیت اظطرار اعلام کرد که در ساعت ساعت۲۳ و ۵۵ دقیقه در فرودگاه اصفهان سالم به زمین نشست.
وی ادامه داد: پس از اطلاع از این خبر، عوامل امدادی اورژانس و آتش‌نشانی آماده باش و به فرودگاه اعزام شدند.
مدیرکل بحران استانداری اصفهان با اشاره به اینکه فرودگاه اصفهان، جانشین فرودگاه تهران در حوادث و سوانح تعیین شده است افزود: خوشبختانه این حادثه مصدومی نداشت.
همچنین سخنگوی سازمان آتش نشانی و خدمات ایمنی شهرداری اصفهان درباره این حادثه گفت: ساعت ۲۳ و ۳۴ دقیقه سه‌شنبه شب پس از اعلام درخواست همکاری برج مراقبت فرودگاه شهید بهشتی از ستاد فرماندهی آتش‌نشانی اصفهان درخصوص اعلام وضعیت اضطراری پرواز تهران- کیش و فرود اضطراری در فرودگاه اصفهان، ۴ تیم کامل با تجهیزات و امکانات لازم از ایستگاه‌های شماره ۶ ، ۷ ، ۱۵ و ۱۹ به فرودگاه اصفهان اعزام شدند.
فرهاد کاوه آهنگران افزود: این پرواز با بیش از ۱۷۰ مسافر خود سالم به زمین نشست و مشکل خاصی به وجود نیامد.
وی تصریح کرد: توضیحات کامل در این خصوص به عهده کارشناسان فنی فرودگاه شهید بهشتی اصفهان است.                           ",https://www.asriran.com/003VB4
834833,۱۴۰۱/۰۱/۲۴,بین الملل,"بایدن، پوتین را به ""نسل‌کشی"" متهم کرد","بایدن گفت: بودجه خانواده های آمریکایی و توانایی آنها برای تامین سوخت خودروهایشان نباید به اعلام جنگ از سوی یک ""دیکتاتور"" که در آن سوی جهان ""نسل کشی"" می کند، وابسته باشد.","جو بایدن رئیس جمهوری آمریکا در تداوم حملات لفظی اش به ولادیمیر پوتین رئیس جمهوری روسیه برای نخستین بار او را به ""نسل کشی"" متهم کرد و گفت که حمله پوتین به اوکراین ""نسل کشی"" است.
به گزارش ایرنا، رئیس جمهوری آمریکا که عصر سه شنبه به وقت محلی در ایالت آیووا سخن می گفت، این مطلب را بیان کرد و اقدامات دولتش برای رسیدگی به هزینه های رو به افزایش در آمریکا را در میان جنگ در اوکراین برشمرد.
بایدن گفت: بودجه خانواده های آمریکایی و توانایی آنها برای تامین سوخت خودروهایشان نباید به اعلام جنگ از سوی یک ""دیکتاتور"" که در آن سوی جهان ""نسل کشی"" می کند، وابسته باشد.
بایدن که این اظهارات‌ را هنگام توضیح در مورد تلاش ها برای رسیدگی به قیمت بالای سوخت در آمریکا در نتیجه جنگ اوکراین بیان می کرد، مدعی شد همه تلاش ها تحت اختیارات خود را از طریق فرمان های اجرایی انجام می دهم تا قیمت ها را کاهش دهم و به افزایش هزینه ناشی از اقدامات پوتین رسیدگی کنم.
رئیس جمهوری آمریکا ادامه داد برای کمک به مقابله با افزایش قیمت ها، اجازه آزادسازی یک میلیون بشکه در روز از ذخایر راهبردی نفت را صادر کرده ام.
وزارت کار ایالات متحده آمریکا روز سه شنبه به وقت محلی اعلام کرد که نرخ تورم در این کشور در یک سال گذشته ۸.۵ درصد افزایش یافت که این بالاترین افزایش تورم در امریکا در ۴۰ سال گذشته است.
در یک سال گذشته هزینه غذا، سوخت، مسکن و سایر نیازهای ضروری در آمریکا بر مصرف کنندگان آمریکایی فشار آورده و افزایش درآمدها را خنثی کرده است.
گزارش دولت آمریکا همچنین نشان می دهد که تورم در ماه های فوریه تا مارس ۱.۲ درصد افزایش یافته است در حالی که این تورم در ماه های ژانویه تا فوریه ۰.۸ درصد افزایش داشته است.
برای اولین بار نرخ تورم در آمریکا شامل افزایش قیمت بنزین در این کشور می شود که پس از وقوع جنگ اوکراین در ۲۴ فوریه روندی افزایشی را از خود نشان داده است.
بر اساس گزارش انجمن خودرو آمریکا، میانگین قیمت هر گالن(حدود ۳.۸ لیتر) بنزین در آمریکا ۴.۱۰ دلار است که نسبت به سال گذشته ۴۳ درصد افزایش یافته است. اگرچه قیمت سوخت در آمریکا در چند هفته گذشته کاهش یافته است.
افزایش قیمت انرژی منجر به افزایش هزینه های حمل و نقل کالاها و قطعات در سراسر آمریکا شده که به نوبه خود به رشد قیمت ها برای مصرف کنندگان کمک کرده است.
رکود بزرگ در آمریکا و جنگ جهانی اول و دوم
آمریکا از ماه اوت ۱۹۲۹ تا مارس ۱۹۳۳ میلادی شاهد رشد منفی ۲۶.۷ درصدی تولید ناخالص داخلی خود بود و پس از آن از ماه مه ۱۹۳۷تا ژوئن ۱۹۳۸ میلادی نیز باردیگر شاهد رشد منفی ۱۸.۲ درصدی در تولید ناخالص داخی خود شد.
به گفته تحلیلگران، درهر دو مورد رکورد بزرگ اقتصادی آمریکا در دهه سی میلادی قرن گذشته، وقوع جنگ جهانی دوم طی سال های ۱۹۳۹ تا ۱۹۴۵ و ورود آمریکا به این جنگ موجب برون رفت واشنگتن از این تقلای اقتصادی شد.
هزینه تحمیلی ۸ تریلیون دلاری دو جنگ عراق و افغانستان بر مردم آمریکا
خبرگزاری آسوشیتدپرس در ۱۷ بهمن ۱۳۹۸ گزارش داد که هزینه جنگ آمریکا در عراق بالغ بر دو تریلیون دلار شده است، این خبرگزاری آمریکایی در مرداد ۱۴۰۰ که شبکه خبری «سی بی اس نیوز» آمریکا نیز آنرا منعکس کرد، هزینه جنگ ۲۰ ساله در افغانستان که آمریکا به بهانه سرنگونی طالبان و سپس با قدرت گرفتن این گروه به این کشور، از آنجا گریخت؛ ۶.۵ تریلیون دلار اعلام کرد، هزینه ای که از محل مالیات دهندگان آمریکایی توسط کاخ سفید در دو جنگ هزینه شد.
تارنمای «هیپوتزس» ۲۹ اسفند ۱۳۹۵ در تحلیلی نوشته بود: آمریکایی که ۲۳۹ سال از بوجود آمدن آن می گذرد، ۲۲۲ سال آن را در جنگ گذرانده است (اعلام استقلال آمریکا ۴ژوئیه ۱۷۷۶برابر با ۱۴تیر ۱۱۵۵هجری شمسی است).
به گزارش ایرنا، ولادیمیر پوتین رئیس جمهوری روسیه ۲۱ فوریه ۲۰۲۲ (دوم اسفند ۱۴۰۰) با انتقاد از بی‌توجهی غرب به نگرانی‌های امنیتی مسکو، استقلال جمهوری‌های خلق دونتسک و لوگانسک را در منطقه دونباس به رسمیت شناخت. پوتین سه روز پس از آن، پنجشنبه ۲۴ فوریه (۵ اسفند ۱۴۰۰) نیز عملیاتی نظامی که آن را ""عملیات ویژه"" خواند، علیه اوکراین آغاز کرد و به این ترتیب روابط پرتنش مسکو - کی‌یف به رویارویی نظامی تغییر وضعیت داد. جنگ در اوکراین و واکنش‌ها به اقدام روسیه همچنان ادامه دارد.                           ",https://www.asriran.com/003VB3
834832,۱۴۰۱/۰۱/۲۴,اقتصادی,ردپای مشکوک بدهکاران بزرگ بانکی در پرونده‌های خصوصی‌سازی/ خانواده صرافان چگونه خریدار «رفاه» شدند؟!,طبق بررسی‌ها، نام احمد صرافان ۷ بار در فهرست مدیونین کلان بانک صادرات که اخیراً منتشر شده، وجود دارد و نشان می‌دهد وی و برخی دیگر از نزدیکانش، بدهکاری فراوانی به بیت‌المال و نظام بانکی دارند,"خانواده صرافان که جزو ابربدهکاران بانک صادرات هستند، در دولت قبل در یک خصوصی‌صازی صوری، با قیمت پایین فروشگاه رفاه را از آن خود کردند.
به گزارش ایرنا، پس از ابلاغ دستورات و پیگیری‌های مسئولان وزارت اقتصاد و بانک مرکزی، تعدادی از بانک‌های مهم کشور اقدام به انتشار فهرست بدهکاران بزرگ خود کردند تا مشخص شود عزم و اراده دولت برای مقابله با این پدیده شوم در نظام اقتصادی و پولی کشور، بسیار جدی‌تر از دولت‌های گذشته است.
با انتشار این فهرست، بهتر از قبل مشخص شد در سال‌های گذشته برخی اشخاص حقیقی و حقوقی با سوء استفاده از خلأهای قانونی و نظارتی و نبود شفافیت اطلاعاتی به‌ویژه عدم اعتبارسنجی مناسب، نسبت به اخذ تسهیلات کلان اقدام و علیرغم مساعدت‌ها و فرصت‌های اعطایی، در بازپرداخت تسهیلات کوتاهی کرده‌اند.
آنچه در بررسی اولیه این فهرست منتشره توسط بانک‌های دولتی قابل مشاهده است، وجود اعضای برخی خانواده‌های مشهور است که در سال‌های گذشته، توانسته‌اند به لطف تسهیلات کلان بانکی و عدم پرداخت معوقات خود، صاحب مجموعه‌های مختلف اقتصادی و صنعتی شده و ثروت خود را صد چندان کنند.
به عنوان مثال، یکی از این خانواده‌ها که جزو بدهکاران کلان بانک صادرات محسوب می‌شوند، برادران صرافان هستند که در قالب بیش از ۱۰ شرکت، اقدام به دریافت تسهیلات بانکی نموده اما اراده و اقدام موثری در بازپرداخت این مبالغ نداشته‌اند.

خانواده صرافان چهارسوقی که با نام «صرافان برادرز» نیز شناخته می‌شوند از جمله خانواده‌های شهیر در بازار برنج ایران هستند. پیش از آن نیز هنگامی که در سال ۹۶، فهرست ۲۰ بدهکار بزرگ بانک سرمایه منتشر شد، نام صرافان در این میان دیده می‌شد و گروه صرافان با دریافت ۴ فقره وام بانکی ۱۷۳ میلیارد و ۲۶۶ میلیون تومانی از بانک سرمایه، در ردیف بدهکاران بزرگ بانکی در این مجموعه قرار داشت.
این موضوع از آنجا اهمیت دوچندان پیدا می‌کند که نام این خانواده در زمان خصوصی‌سازی و واگذاری سهام یکی از مجموعه‌های بزرگ اقتصادی یعنی فروشگاه رفاه نیز مطرح شد. طبق بررسی‌ها شرکت آتیه فروز سبحان، یکی از سهامداران و از اعضای هیات مدیره فروشگاه رفاه (در ادوار پس از واگذاری سهام مجموعه‌های دولتی) محسوب می‌شود که در سال‌های گذشته، یکی از اعضای خانواده صرافان یعنی احمد صرافان چهارسوقی به عنوان رئیس هیات مدیره آن فعالیت می‌کرده است.
البته پس از آن نیز، نام برخی دیگر از اعضای خانواده صرافان را می‌توان در برخی اسناد مالی و اداری فروشگاه‌های زنجیره‌ای رفاه مشاهده کرد.
طبق بررسی‌ها، نام احمد صرافان ۷ بار در فهرست مدیونین کلان بانک صادرات که اخیراً منتشر شده، وجود دارد و نشان می‌دهد وی و برخی دیگر از نزدیکانش، بدهکاری فراوانی به بیت‌المال و نظام بانکی دارند اما با این وجود، توانسته‌اند با ابهاماتی که هم‌اکنون توسط دستگاه‌های نظارتی و عدلیه در حال پیگیری است، خریدار سهام ارزشمند فروشگاه رفاه شوند.
این در حالی است که تا سال ۱۳۹۳ که نام یک عضو خانواده صرافان به عنوان رئیس هیات مدیره شرکت آتیه فروز سبحان وجود داشته، وی دارای پرونده سنگین مالیاتی بوده و اداره کل مالیاتی اصفهان در سال‌های بعد، اخطارهای متعددی را برای احضار وی منتشر کرده است.

اما خانواده صرافان با همکاری خانواده ابوترابیان، موفق می‌شوند در دولت گذشته ضمن تصاحب بخش قابل توجهی از سهام یک مجموعه بزرگ اقتصادی که صدها ملک ارزشمند و دارایی‌های فراوان دیگر داشته، این فروشگاه زنجیره‌ای را به اموال خود اضافه کنند بدون آنکه اقدام موثری در زمینه پرداخت بدهی‌های کلان خود انجام دهند.
با این اوصاف، به نظر می‌رسد در گام‌های بعد و پس از وصول تسهیلات معوق و بدهی‌های صدها میلیاردی افراد موجود در فهرست بدهکاران بانک‌های دولتی، سراغ اموال و سهامی رفت که با این تسهیلات معوق خریداری و تصاحب شده‌اند.
خبرگزاری ایرنا در روزهای آینده، وضعیت و اقدامات مبهم دیگر اسامی موجود در فهرست بدهکاران بزرگ بانکی را نیز بررسی و منتشر خواهد کرد.                           ",https://www.asriran.com/003VB2
834830,۱۴۰۱/۰۱/۲۴,اقتصادی,سايپا: ضخامت لايه هاي رنگ محصولات كاملا استاندارد و بين 100 تا 120 ميكرون است,ضخامت قابل قبول رنگ خودروها مطابق با استانداردهاي روز دنيا بين 80 تا 140 ميكرون است كه اين ضخامت از بخش هاي رنگ ED، آستر، رويه و كلر تشكيل شده است,"ضخامت لايه هاي رنگ محصولات گروه خودروسازي سايپا كاملا استاندارد و حتي بالاتر از اعداد مصوب و تكليف شده است.
به گزارش سايپانيوز، گروه خودروسازي سايپا همواره در بخش رنگ خودرو پيشتاز بوده و در رنگ آميزي بدنه هاي توليد از ربات هاي پيشرفته و رنگ هاي پايه آب و حلال مطابق با آخرين تكنولوژي روز صنعت خودروسازي استفاده می کند.
گروه خودروسازي سايپا سعي و تلاش كرده كه با هدف ارتقاي كيفيت، تمام استانداردهاي مربوط به توليد خودرو را رعايت كند و حتي فراتر از استانداردهاي محول شده، حركت كند. حوزه رنگ نيز از اين قاعده استثناء نيست به گونه اي كه اين مجموعه ضمن استفاده از بهترين نوع رنگ، ضخامت لايه هاي رنگي را به طور كامل رعايت كرده است.
ضخامت رنگ خودرو در محصولات سايپا به صورت روزانه و مستمر در هر شيفت كنترل مي شود و گزارش ها، به صورت مستند وجود دارد. از اين رو تمام اقدام هاي كه در اين خصوص انجام مي شود بر اساس اصول و قواعدي است كه تمام خودروسازان جهاني دنبال مي كنند.
با توجه به اطمينان از وضعيت رنگ محصولات سايپا، اين مهم (رنگ خودروها) در محصولات سايپا بين 3 تا 5 سال گارانتي دارد، لذا تمام مشتريان اين مجموعه مي توانند به رنگ خودروهاي خود اطمينان كامل داشته باشند.
تاكيد مي شود ضخامت قابل قبول رنگ خودروها مطابق با استانداردهاي روز دنيا بين 80 تا 140 ميكرون است كه اين ضخامت از بخش هاي رنگ ED، آستر، رويه و كلر تشكيل شده است، از آنجا كه گروه خودروسازي سايپا در اين حوزه سرمايه گذاري مناسبي انجام داده است، در تمام محصولات ضخامت رنگ بين 100 تا 120 ميكرون است.
شايان ذكر است فيلمي در فضاي مجازي منتشر شده كه در آن، ضخامت لايه هاي رنگ محصولات گروه خودروسازي سايپا، زير سوال رفته است. توضيحات ياد شده گواه آن است كه ادعاها نسبت به پايين بودن ضخامت رنگ محصولات سایپا به هيچ عنوان صحت ندارد.                           ",https://www.asriran.com/003VB0
834829,۱۴۰۱/۰۱/۲۴,اقتصادی,ایران خودرو اعلام کرد :شاسی بلند جدید در سبد محصولات اضافه شد/  هایما 8S امسال به تولید می‌رسد (+عکس),امسال، علاوه بر افزوده شدن هایما 8S، تیراژ تولید هایما S5 و S7 پلاس افزایش خواهد یافت.,"مدیرعامل ایران خودرو خراسان از افزایش ظرفیت تولید خودروهای شاسی بلند خبر داد و گفت: با بهره‌برداری از پروژه توسعه خط مونتاژ در اواسط امسال، علاوه بر افزوده شدن هایما 8S، تیراژ تولید هایما S5 و S7 پلاس افزایش خواهد یافت.
بیژن زاهدی فرد افزود: خط جدید تولید که توسط شرکت تام و ایران‌خودرو خراسان در حال تجهیز است، امکان تولید همزمان چهار مدل خودروی شاسی بلند را دارد.


وی با بیان این‌که بیش از ۴۹ هزار دستگاه خودروی هایما از سال ۱۳۹۴ در ایران خودرو خراسان تولید شده است، ادامه داد: تعهدات خودروهای هایما به روز شده و هیچ گونه تعهد معوقی وجود ندارد. در سال گذشته نیز برنامه تولید محصولات هایما، ۱۰ هزار دستگاه خودرو بوده که حدود ۹۰ درصد آن محقق شده است.
زاهدی فرد بر افزایش سطح داخلی‌سازی قطعات محصولات هایما و ضرورت آموزش‌های لازم به نمایندگی‌های خدمات پس از فروش تاکید کرد و گفت: این برنامه ها در دستور کار ساپکو و ایساکو قرار گرفته است.
وی همچنین در خصوص تولید محصول جدید گفت: برنامه تولید هایما 8S در دستور کار ایران‌خودرو‌ خراسان قرار دارد که طبق هدف‌گذاری، امسال به بازار عرضه خواهد شد.                           ",https://www.asriran.com/003VAz
