News_ID,Date,Subject,Title,Summary,Body,Short_link
834877,۱۴۰۱/۰۱/۲۴,سیاست خارجی,تحلیل کیهان از حمله به کنسولگری ایران در هرات: پشت صحنه این تعرض گروه‌های غربگرا هستند,اغراض امنیتی توطئه‌های مذکور، اختلاف‌افکنی و تفرقه‌اندازی میان دو ملت همسایه ایران و افغانستان است که پیوندها واشتراکات دیرینه در زمینه‌های گوناگون دارند. هدف اقتصادی این سناریوها و جنایات نیز ضربه‌زدن به پروژه خنثی‌سازی تحریم‌ها است.,"کیهان نوشت: روز دوشنبه عده‌ای به سرکنسولگری ایران در هرات حمله ور شده و اقدام به سنگ پرانی کردند.
منابع در هرات می‌گویند پشت صحنه این تعرض گروه‌های غربگرای «جنبش عدالت و آزادی» و «تیم بانوان عدالت‌جو» هستند که پیش از این توسط غربی‌های حاضر در افغانستان تأمین مالی می‌شدند.
این اقدام سخیف به علاوه شهادت دو طلبه اهل سنت در گنبد کاووس، شهادت دو روحانی در حرم مطهر رضوی و انتشار کلیپ‌های مشکوک و جعلی به مثابه تکه‌های یک پازل با اهداف پلید امنیتی و اقتصادی از سوی دشمن علیه دو ملت ایران و افغانستان طراحی و چیده شده‌اند.
اغراض امنیتی توطئه‌های مذکور، اختلاف‌افکنی و تفرقه‌اندازی میان دو ملت همسایه ایران و افغانستان است که پیوندها واشتراکات دیرینه در زمینه‌های گوناگون دارند. هدف اقتصادی این سناریوها و جنایات نیز ضربه‌زدن به پروژه خنثی‌سازی تحریم‌ها است.
دولت سیزدهم با حرکت درون‌زا و متکی به توانمندی‌های ملی، دیپلماسی اقتصادی و گسترش تجارت خارجی و همکاری‌ها با کشورهای همسایه، معطل مذاکرات معطوف به برجام و گردن‌کشی‌های غرب نمانده است، تضمین مطمئن درباره عدم تکرار عهدشکنی می‌خواهد و در حال خنثی‌سازی تحریم و تعامل پویا و فعال با شرق است. دولت صادرات و شرکای تجاری خود را با اولویت همسایگان تنوع بخشیده و تحریم را زیر پا می‌‎گذارد.
واردات گسترده واکسن، عضویت ایران در پیمان شانگهای، انعقاد قرارداد سوآپ گازی باترکمنستان و آذربایجان، سند همکاری ۲۵ ساله میان ایران و چین، پیگیری همکاری بلندمدت با روسیه، رشد 41 درصدی صادرات، گذر تجارت خارجی کشور از 101 میلیارد دلار در سال 1400، افزایش ۴۰ درصدی صادرات نفت و رشد ۳۵ درصدی متوسط ماهانه صادرات غیرنفتی نسبت به میانگین هشت سال عملکرد دولت روحانی در پنج ماه نخست فعالیت دولت سیزدهم، رساندن رقم صادرات غیرنفتی به بالاترین رقم پس از انقلاب، قراردادهای جدید باترکیه و پاکستان و عراق و سوریه طلیعه‌هایی از رویکرد مبارک دولت سیزدهم و در شرایط تحریم و بدون برجام و FATF است.
از این رو، دولت با سیاست خارجی پویا و فعال، خنثی‌سازی تحریم و افزایش تعامل و تجارت خارجی با همسایگان، نقش مؤثر خود در تکوین «قرن جدید آسیایی» و انتقال محور قدرت از غرب به شرق را ایفا می‌کند و در حال به هم زدن نقشه شوم غرب برای نابودی توانمندی‌های ایران است. افزون بر این، دشمن از محور مقاومت شکست‌های پی‌درپی خورده است و از سر عجز به تکاپو افتاده است.                           ",https://www.asriran.com/003VBl
834875,۱۴۰۱/۰۱/۲۴,اجتماعی ,پرداخت دیه سربازان مقتول و مجروح در محل خدمت برعهده کیست؟,سال ۱۴۰۰ مبلغ ۱۴ میلیارد تومان و سال ۱۳۹۹ مبلغ ۲۳ میلیارد تومان از بودجه تعیینی در قانون به پرونده هایی که از ارتش جمهوری اسلامی ایران، نیروی انتظامی جمهوری اسلامی ایران و سپاه پاسداران انقلاب اسلامی معرفی شد، پرداخت کردیم.,"ایرنا نوشت: معاون حقوقی و امور مجلس وزیر دادگستری گفت: سربازانی که در محل خدمت دچار حادثه یا کشته می‌شوند طبق قانون، مشمول دریافت دیه از بیت المال هستند و وزارت دادگستری در سال ۱۴۰۰، مبلغ ۱۴ میلیارد تومان به مشمولان این قانون پرداخت کرده است.
علی فرهادی اظهار داشت: ۲ سال است که طبق قانون پرداخت دیه مستحقان دریافت دیه شامل مقتولان و مجروحان ناشی از عبور غیرمجاز از مرز که توسط یگان‌های ارتش، سپاه و مرزبانی مورد اصابت گلوله قرار گرفته‌اند و همچنین سربازانی که در محیط پادگان در اثر حوادث مختلف کشته یا مجروح می‌شوند، با معرفی ارتش جمهوری اسلامی ایران، نیروی انتظامی جمهوری اسلامی ایران و سپاه پاسداران انقلاب اسلامی به وزارت دادگستری محول شده است.
وی ادامه داد: بر این اساس، وزارت دادگستری تکلیف دارد از منبع ۵۰۰ میلیارد تومان تا سقف ۲۰ درصد را به این موضوع اختصاص دهد.
فرهادی اظهار داشت: سال ۱۴۰۰ مبلغ ۱۴ میلیارد تومان و سال ۱۳۹۹ مبلغ ۲۳ میلیارد تومان از بودجه تعیینی در قانون به پرونده هایی که از ارتش جمهوری اسلامی ایران، نیروی انتظامی جمهوری اسلامی ایران و سپاه پاسداران انقلاب اسلامی معرفی شد، پرداخت کردیم.
وی اضافه کرد: در پرداخت این پرونده‌ها به روز هستیم حتی پرونده‌های سالیان قبل هم صفر شده است یعنی پرونده‌هایی مربوط به ۴۰ سال قبل هم بود که سربازانی در پادگان‌ها دچار آسیب شده بودند و مشمول دریافت دیه شدند که با معرفی ارتش جمهوری اسلامی ایران، نیروی انتظامی جمهوری اسلامی ایران و سپاه پاسداران انقلاب اسلامی دیه به آنها پرداخت شد.
در تبصره ۱۰ قانون بودجه سال ۱۴۰۱ آمده است: «وزارت دادگستری مکلف است از محل منابع جزء (۳) این بند نسبت به پرداخت دیه مستحقان دریافت دیه شامل مقتولان و مجروحان ناشی از عبور غیرمجاز از مرز که توسط یگانهای ارتش، سپاه و مرزبانی مورد اصابت گلوله قرار گرفته‌اند و همچنین سربازانی که در محیط پادگان در اثر حوادث مختلف کشته یا مجروح می‌شوند، با معرفی ارتش جمهوری اسلامی ایران، نیروی انتظامی جمهوری اسلامی ایران و سپاه پاسداران انقلاب اسلامی تا سقف بیست درصد (۲۰%) از محل اعتبارات ردیف ۶۴ ـ۵۳۰۰۰۰ اقدام نماید.»                           ",https://www.asriran.com/003VBj
834873,۱۴۰۱/۰۱/۲۴,اقتصادی,چرا مجلس اصرار دارد سالی 1.4میلیارد دلار انرژی تلف شود؟,خوب است نمایندگان بگویند که دولت برای ایجاد این زیرساخت‌ها که قرار است توجیه صرفه‌جویی انرژی را به عاملی بی‌اهمیت بدل کند، چقدر باید هزینه کند؟ و آیا اساسا ایجاد چنین زیرساخت‌هایی ممکن است؟,"اعتماد نوشت: رییس‌کمیسیون اجتماعی مجلس گفته طرح تغییر ساعت رسمی کشور که شورای نگهبان ایراداتی را به آن وارد دانسته بود با حضور طحان نظیف عضو حقوقدان شورای نگهبان بررسی شده و ابهام مورد نظر رفع شد، اما اجرای این قانون به آغاز سال ۱۴۰۲ موکول شد.
بر اساس ماده ۸۲ قانون مدیریت خدمات کشوری به دولت این اختیار داده شد که ساعات کاری ادارات را تعیین کند، ساعت رسمی کشور امسال تغییر نمی‌کند اما دولت باید در سال جاری زیرساخت‌های لازم برای اجرای این قانون را آماده کند.
فارغ از اینکه چرا نمایندگان مجلس شورای اسلامی در این وانفسای مشکلات تا این حد بر موضوع تغییر نکردن ساعت رسمی کشور اصرار دارند و این مساله را تا این اندازه مهم می‌دانند، باید گفت که در طرح جدیدی با هدف تامین نظر شورای نگهبان در کمیسیون اجتماعی به تصویب رسیده، ابهاماتی وجود دارد.
نخست اینکه کمیسیون اجتماعی تصویب کرده که دولت باید زیرساخت‌های لازم را برای فراهم شدن اجرای عدم تغییر ساعت رسمی کشور در سال 1402 فراهم کند. مشخص نیست که این زیرساخت‌هایی که نمایندگان از آن سخن به میان می‌آورند، چیست؟
یکی از مهم‌ترین دلایل تغییر ساعت رسمی کشور در هر سال، صرفه‌جویی انرژی است. تغییر ساعت رسمی کشور در ابتدای فروردین ماه حدود ۲ درصد در اوج مصرف و 4 درصد در مصرف انرژی تاثیر دارد. از سوی دیگر بر مبنای بررسی‌های علمی انجام شده روی منحنی بار 24 ساعته کل کشور، طی سال‌های 1393 تا 1400 به‌طور متوسط حدود 4 درصد از مصرف برق در 6 ماه نخست سال از محل اجرای طرح تغییر ساعت صرفه‌جویی شده که معادل 106 میلیارد کیلووات ساعت در طول 7 سال اخیر است. انرژی صرفه‌جویی شده ناشی از این طرح به‌طور متوسط سالانه بالغ بر یک میلیارد و چهارصد میلیون دلار بوده است.
آیا منظور نمایندگان این است که دولت زیرساخت‌هایی ایجاد کند تا نیازی به صرفه‌جویی این یک میلیارد دلار نباشد؟ خوب است نمایندگان بگویند که دولت برای ایجاد این زیرساخت‌ها که قرار است توجیه صرفه‌جویی انرژی را به عاملی بی‌اهمیت بدل کند، چقدر باید هزینه کند؟ و آیا اساسا ایجاد چنین زیرساخت‌هایی ممکن است؟
تنها راهی که می‌توان متصور شد، این است که وزارت نیرو طی یک‌سال آینده آنقدر تراز تولید برق را بالا ببرد تا با تراز مصرف تعادل داشته باشد. اما حتی این اقدام هم عامل صرفه‌جویی را از تغییر ساعت رسمی کشور حذف نمی‌کند. خوب است نمایندگان به این موضوع فکر کنند که با یک میلیارد و چهارصد میلیون دلار چند صد هزار شغل می‌توان ایجاد کرد. چرا دولت باید اجرای طرحی که صرفه‌جویی انرژی را منتفی می‌کند، از خودش هزینه کند و زیرساخت آماده کند؟ کجای این اقدام منطقی است؟ چرا مجلس از داستان مشابهی که در دولت محمود احمدی‌نژاد در خصوص تغییر ساعت رسمی کشور به راه افتاد، درس نمی‌گیرد.                           ",https://www.asriran.com/003VBh
834872,۱۴۰۱/۰۱/۲۴,اجتماعی ,جریمه کرونایی ۲۹۹ هزار خودور در نوروز به دلیل عدم تزریق واکسن مالکان,وزارت بهداشت براساس کد ملی افراد به ما اعلام کرده است که چه کسانی واکسن تزریق نکرده اند و ما هم برهمین اساس در ایام عید ۲۹۹ هزار خودرو را به دلیل عدم واکسیناسیون مالکان آنها اعمال قانون کرده‌ایم.,"رئیس پلیس راهور انتظامی کشور از جریمه ۲۹۹ هزار خودرو به دلیل عدم تزریق واکسن توسط مالکانشان خبر داد.
سردار کمال هادیانفر، رییس پلیس راهور انتظامی کشور در گفت‌وگو با ایلنا درباره جریمه خودروهایی که مالکان آنها واکسن نزده در ایام نوروز به سفر رفته بودند، گفت: در بحث جریمه های کرونایی وزارت بهداشت براساس کد ملی افراد به ما اعلام کرده است که چه کسانی واکسن تزریق نکرده اند و ما هم برهمین اساس در ایام عید ۲۹۹ هزار خودرو را به دلیل عدم واکسیناسیون مالکان آنها اعمال قانون کرده‌ایم.
وی ادامه داد: اگر کسی واکسن زده اما جریمه شده است به هیات های ۵ نفره ما مراجعه کند و نامه واکسن خود را ارائه دهد تا تغییرات اعمال شود.
رئیس پلیس راهور انتظامی کشور در بخش دیگری از صحبت‌هایش درباره استفاده از دست افزار و دوربین البسه برای ماموران راهور گفت: در خصوص دست افزارها تقریبا همه ماموران ما دست افزار دریافت کرده اند و در این زمینه تکمیل شده ایم. یک هزار و ۵۰۰ عدد دست افزار نیز در همین شب عید بین همکارانمان توزیع کردیم.
سردار هادیانفر خاطرنشان کرد: صدور قبض های کاغذی دیگر برای ما کارایی ندارد و اقدامات ما در روی دست افزار انجام می شود.
وی ادامه داد: در خصوص دوربین های البسه نیز عددی که برای ما در نظر گرفته اند هنوز کافی نیست اما پرسنل ما استفاده می کنند.
رئیس پلیس راهور انتظامی کشور تصریح کرد: اساسا یکی از اهداف ما تحول سیستمی در راستای هوشمندسازی است و تلاش می کنیم تا جایی که امکان دارد از سامانه ها و سیستم ها استفاده کنیم و تنش و برخوردمان با مردم به حداقل ممکن برسد.
وی همچنین در پاسخ به این سوال که آیا شرکت های خودروسازی برای خودروهای خود تست انجام می دهند، گفت: براساس قانون سازمان استاندارد این مسئولیت را برعهده دارد و از آنجا که سازمان استاندارد نیروی لازم برای این کار را ندارد از 4 یا 5 شرکت پیمانکار برای این کار استفاده می کند.
وی ادامه داد: وزارت صمت و محیط زیست نیز برای این آزمایشات، بیشتر از شرکت های خصوصی استفاده می کنند.
رییس پلیس راهور انتظامی کشور گفت: اما ما به عنوان پلیس از یک منظر در خط تولید باید بازدید داشته باشیم و از شماره شاسی شماره موتور و درست بودن ارکان وسیله بازدید می‌کنیم.
سردار هادیانفر خاطرنشان کرد: اما براساس قانون اگر سازمان استاندارد، وزارت صمت و محیط زیست تاییدیه برای خودرو صادر کنند ما باید این خودرو را پلاک کنیم. ما امیدواریم دستگاه‌های متولی روی کیفی سازی و ایمنی کار کنند و اگر این کار نکنند ما از طریق همان بازدیدی که از خط تولید داریم و باید انجام دهیم این موارد را نیز کنترل می کنیم.
رییس پلیس راهور انتظامی کشور تاکید کرد: ما امیدواریم در سال ۱۴۰۱ همه دستگاه‌های مسئول را برای ایمنی در تردد و کاهش تصادفات پای کار بیاوریم.                           ",https://www.asriran.com/003VBg
834869,۱۴۰۱/۰۱/۲۴,فناوری و IT,متاورس به زبان ساده؛ قسمت اول (فیلم),در متاورس چه می‌گذرد؟ با چه چهره و لباسی در متاورس ظاهر می‌شوید؟ قرارها و کسب و کار و خرید در متاورس چطوری است؟ ببینید.../ راوی,کد ویدیو  دانلود    فیلم اصلی                                     ,https://www.asriran.com/003VBd
834871,۱۴۰۱/۰۱/۲۴,اخبار سلامت,افزایش پوسیدگی‌های دندانی در پساکرونا,عمده امکانات و یونیت‌های ما داخلی است اما متاسفانه طی دو سال گذشته به شدت بودجه‌های حوزه ما ضعیف شد و افت داشتیم که این می‌تواند یکی از عوامل تاثیر پذیر از نبود بودجه در بخش بهداشت باشد.,"کارشناس اداره سلامت دهان و دندان وزارت بهداشت با اشاره به اینکه کاهش مراجعات دندانپزشکی در دوران کرونا، گفت: با شیوع کرونا خدمات دندانپزشکی تحت تاثیر قرار گرفت و فقط بیشتر خدمات اورژانسی انجام می‌شد. انتظار داریم با عادی شدن وضعیت کرونا ارائه خدمات مجددا از سر گرفته شود. به طور کلی این شرایط سبب می‌شود در آینده شاهد افزایش مشکل پوسیدگی دندانی باشیم.
دکتر محمدحسین کریمی در گفت‌وگو با ایسنا، گفت: از سال ۱۳۹۳ با آغاز صحبت‌ها برای طرح پزشک خانواده زیرساخت‌ها در بحث دندانپزشکی نیز بهبود یافت و ناوگان و تجهیزات بروز شدند. از سال ۱۳۹۴ نیز حدود ۱۵۰۰ دندانپزشک با قرارداد بیمه روستایی و سپس شهری به کار گرفته شدند و با استفاده از نیروهای رسمی خود و بیمه روستایی تقریبا اکثر مراکز مجهز شده و ارائه خدمات به خوبی انجام می‌شد.
وی با اشاره به آسیب‌های کرونا در زمینه دندانپزشکی، اظهار کرد: با شیوع کرونا خدمات دندانپزشکی تحت تاثیر قرار گرفت و بیشتر خدمات اورژانسی انجام شد و انتظار داریم با عادی شدن وضعیت کرونا، ارائه خدمات دندانپزشکی مجددا از سر گرفته شود. از طرفی با تعطیلی مدارس خیلی از برنامه‌های پیشگیرانه در مدارس نیز تحت تاثیر قرار گرفت و به طور کلی این شرایط سبب می‌شود در آینده شاهد افزایش مشکل پوسیدگی دندانی باشیم.
او درباره شاخص پوسیدگی دندان در کشور بیان کرد: پایش جدیدی در این زمینه صورت نگرفته است و آخرین پایش انجام شده مربوط به سال ۹۵ است که عدد ۱.۸۴ را به ما نشان داد. شاخص پوسیدگی دندان در سال ۱۳۷۷ عدد ۱.۵، در سال ۱۳۸۳ عدد ۱.۶۲ و در سال ۱۳۹۱ عدد ۲.۰۹ را نشان می‌دهد. همچنین DMFT (شاخص پوسیدگی دندان) دندان‌های دائمی کودکان ۱۲ ساله کشور در سال ۱۳۷۴ عدد ۲.۰۲ بوده است.
کریمی تاکید کرد: بحث‌های زیادی بر شاخص‌های بهداشتی حوزه بهداشت دهان و دندان وجود دارد. از سال‌ها پیش طرح بسیار خوب استفاده از دهانشویه سدیم فلوراید را دنبال می‌کردیم اما مشکل حوزه بهداشت این است که کارشناسی‌های غلطی بر برنامه‌ها انجام می‌شود و برخی چنین طرحی را موفق نمی‌دانند. این درحالی است که استفاده از دهانشویه سدیم فلوراید در زمان خود یکی از بهترین‌ طرح‌ها بود. به عنوان مثال در شهری که بنده مشغول به کار بودم در آغاز این طرح در سال ۷۱ حدود ۷۰ نفر در روز مراجعه می‌کردند تا دندان خود را بکشند و این عدد در سال ۱۳۸۵ بین ۱۰ تا ۱۵ نفر در روز شده بود. در واقع شاید شاخص‌های پوسیدگی آن اندازه که میخواستیم بهبود نیافته است اما این طرح بعد از چند سال آثار مثبت خود را نشان داد. پوسیدگی دندان موضوعی نیست که تمام شود و کل جمعیتی که می‌توانیم تحت پوشش قرار دهیم شاید ۱۰ میلیون نفر باشد اما بازهم اقدامات ما اثرگذار بوده است.
وی درباره برنامه کاهش شاخص پوسیدگی دندانی در گروه سنی ۱۲ ساله‌ها تا سال ۱۴۰۰ و تحقق آن، تصریح کرد: به نظر بنده تمام برنامه‌های سلامت دهان و دندان تاثیرگذار بوده است ولی در این زمینه پایشی نداشتیم که ببینیم آیا این هدف محقق شده است یا خیر.
او درباه وضعیت تجهیز مراکز دندانپزشکی، گفت: عمده امکانات و یونیت‌های ما داخلی است اما متاسفانه طی دو سال گذشته به شدت بودجه‌های حوزه ما ضعیف شد و افت داشتیم که این می‌تواند یکی از عوامل تاثیر پذیر از نبود بودجه در بخش بهداشت باشد. این درحالی است که هزینه تجهیزات و امکانات هم افزایش چشمگیری داشته است. قطعا با کمبودهایی هم مواجه هستیم اما اخیر بخصوص طی مدت کرونا بازخوردی در این زمینه نداشتیم.
وی درباره پایگاه‌های سیار دندانپزشکی نیز گفت: این موضوع یکی از بهترین‌ طرح‌های ادوار قبل بود. اولین جایی که جرقه این اتفاق خورد دانشگاه علوم پزشکی کرمان بود که بین مراکز بهداشت و دانشکده‌ها قرارداد بستیم که ۲۰ دانشجوی دندانپزشکی را دانشگاه‌ها به ما بدهند و یونیت سیار و تجهیزات را هم ما تامین می‌کردیم تا ارائه خدمت صورت گیرد و به جرات یکی از بروزترین طرح‌هایی بود که انجام شد که به مرور اجرای آن ضعیف شد. البته این طرح با مشکلات زیرساختی هم همراه بود اما در کل آن را بسیار راهگشا می‌دانم.
کارشناس اداره سلامت دهان و دندان وزارت بهداشت در پایان، بیان کرد: ارائه خدمات دندانپزشکی در حوزه بهداشت در گروه‌های هدف شامل سنین زیر 6 سال، 6 تا 12 سال، زنان باردار تا یک سال پس از زایمان و سالمندان رایگان است. سایر گروه‌ها نیز با نرخ دولتی می‌توانند از حوزه بهداشت خدمت دریافت کنند.                           ",https://www.asriran.com/003VBf
