News_ID,Date,Subject,Title,Summary,Body,Short_link
834895,۱۴۰۱/۰۱/۲۴,عمومی,باریک‌ترین آسمان خراش جهان با موفقیت تکمیل شد + عکس و فیلم,باریک‌ترین آسمان خراش جهان، «۱۱۱ West ۵۷th» که به «برج استاینوی» مشهور است، در منهتن نیویورک سیتی با موفقیت ساخته شد.,"به گزارش دیجیتاو، برج استاینوی با ارتفاع ۴۳۵ متری خود پس از برج سنترال پارک که ۴۷۲ متر ارتفاع دارد، دومین آسمان خراش بلند نیمکره غربی محسوب می‌شود. این برج با نسبت ارتفاع به عرض ۲۴:۱ ساخته شده است.آسمان‌خراش‌هایی که ارتفاع آن‌ها از ۳۰۰ متر بیشتر است را تحت عنوان «بسیاربلند» دسته‌بندی می‌کنند. از دیگر مشخصه‌های این برخ می‌توان به وجود ۸۴ طبقه و در مجموع ۶۰ محل سکونت اشاره کرد که با الهام از «عصرطلایی آسمان خراش منهتن» ساخته شده است.
  

    کد ویدیو  دانلود    فیلم اصلی          
آسمان‌خراش بسیاربلند استاینوی همچنین دارای یک استخر شنا ۲۵ متری و امکانات لوکس دیگری مانند مرکز تناسب اندام با تراس و غذاخوری‌های خصوصی است.این آسمان خراش که در شهر میدتاون منهتن، نیویورک سیتی قرار دارد، توسط شرکت معماری SHoP Architects طراحی شده است. ساخت آن اولین بار در سال ۲۰۱۳ اعلام و سپس در سال ۲۰۱۴ آغاز شد و در فرآیند ساخت آن سه شرکت آمریکایی از جمله JDS Development حضور داشتند.ویژگی‌ها و قیمت باریک‌ترین آسمان خراش جهانباریک‌ترین آسمان‌خراش جهان که با نسبت ارتفاع به عرض ۲۴:۱ ساخته شده، طبیعتا وزن بسیار زیادی هم دارد و برای تحمل آن باید از بتن‌هایی با مقاومت بسیار بالا استفاده می‌شد. هرچند در ویدیوی بسیار کوتاه آن ممکن است برخی آن را پلکانی در نظر بگیرند، اما نمای دور آن بسیار شبیه به یک پَر به نظر می‌رسد.همچنین برای ساخت زینتی که در بالاترین نقطه آن قرار گرفته از مواد اصلی نوعی سفال به نام «تراکوتا» استفاده شده و در شرایط نوری مختلف و از زوایای متفاوت، رنگ و بافت آن تغییر می‌کند.با این حال، قیمت آپارتمان‌های داخلی آسمان خراش به اندازه خود آن جذاب به نظر نمی‌رسند. قیمت آن‌ها از ۷.۷۵ میلیون دلار برای یک استودیو آپارتمان تا ۶۶ میلیون دلار برای پنت هاوس تغییر می‌کند.                           ",https://www.asriran.com/003VC3
834894,۱۴۰۱/۰۱/۲۴,سیاسی,فرمانده نیروی زمینی سپاه: اگر تمام سران آمریکا کشته شوند تقاص خون حاج قاسم پس‌داده نمی‌شود,ما تاکنون به حرکات رژیم صهیونستی و آمریکا پاسخ‌های کوبنده‌ای دادیم؛ ما پس از شهادت حاج قاسم به یک مرز بازدارندگی رسیدیم و دشمنان دیگر آن‌قدر توان ندارند اقدامی علیه جمهوری اسلامی انجام دهند.,"فرمانده نیروی زمینی سپاه پاسداران گفت: خون حاج قاسم آن‌قدر بزرگ است که اگر تمام سران آمریکا کشته شوند تقاص خون حاج قاسم پس‌داده نخواهد شد بنابراین بایستی با شیوه‌های دیگر تقاص خون حاج قاسم را بگیریم.
سردار محمد پاکپور با حضور در گلزار بین‌المللی شهدای استان کرمان و تجدید میثاق و بیعت با سردار شهید حاج قاسم سلیمانی ضمن گرامیداشت یاد این شهید در جمع خبرنگاران بیان کرد: همرزمان و حتی نیروهای تربیت‌شده سردار سلیمانی همچون گذشته و زمان حیات حاج قاسم سلیمانی آمادگی کامل را برای دفع هرگونه تهدید دارند.
وی افزود: این را بعد از شهادت حاج قاسم سلیمانی دیدید و دنیا هم این‌ را امتحان کرده است؛ هرچند خون حاج قاسم آن‌قدر بزرگ است که اگر تمام سران آمریکا کشته شوند تقاص خون حاج قاسم پس داده نخواهد شد بنابراین بایستی با شیوه‌های دیگر تقاص خون حاج قاسم را بگیریم.
پاکپور ادامه داد: ما تاکنون به حرکات رژیم صهیونستی و آمریکا پاسخ‌های کوبنده‌ای دادیم؛ ما پس از شهادت حاج قاسم به یک مرز بازدارندگی رسیدیم و دشمنان دیگر آن‌قدر توان ندارند اقدامی علیه جمهوری اسلامی انجام دهند.
وی اضافه کرد: الان یک معادله تعریف شده و دشمن آن را درک کرده است و می‌داند اگر رعایت نکند ضربه سنگینی خواهد خورد. این معادله را ما ادامه خواهیم داد؛ فرزندان، سربازان و همرزمان حاج قاسم با الهام از فداکاری‌های حاج قاسم در برابر هرگونه توطئه ایستادگی خواهند کرد و دنیا هم این را درک کرده است.
                                                      ",https://www.asriran.com/003VC2
834890,۱۴۰۱/۰۱/۲۴,بین الملل,شلیک مستقیم تانک روسی و آخرین لحظات زندگی ۱۲ سرباز اوکراینی (فیلم),گروهی از سربازان اوکراینی، با دیدن تانک روسی تصور می کنند که همرزمان شان آن را به غنیمت گرفته اند، غافل از این که لحظاتی بعد، با شلیک آن، کشته خواهند شد.,"کد ویدیو  دانلود    فیلم اصلی          

  

    کد ویدیو  دانلود    فیلم اصلی          

یکی از فیلم ها را سرباز اوکراینی گرفته و همان طور که مشخص است، لحظه ای بعد از شلیک، فیلمبرداری اش قطع می شود و احتمالا فیلمبردار جزو کشته هاست.اما فیلم دیگر، از فاصله ای دورتر این ماجرا را ثبت کرده است.                           ",https://www.asriran.com/003VBy
834892,۱۴۰۱/۰۱/۲۴,بین الملل,نیویورک‌تایمز: طالبان تنها در شش ماه، ۵۰۰ نظامی و کارمند حکومت پیشین را کشته‌ یا ربوده است,طالبان پس از تسلط بر افغانستان نظامیان پیشین را پس از بازداشت شکنجه می‌کردند و سپس آنان را با ضرب گلوله یا سربُریدن می‌کُشتند.,"روزنامه‌ی نیویورک تایمز در گزارش تحقیقی‌اش دریافته است که طالبان خلاف وعده عفو عمومی، دست به کشتار گسترده انتقام‌جویانه علیه کارمندان دولت سابق و اعضای نیروهای امنیتی پیشین زده‌اند.
به گزارش ایسنا به نقل از افق نیوز، در این گزارش آمده است که طالبان حدود ۵۰۰ نفر از کارمندان دولت و اعضای نیروهای امنیتی پیشین را در شش ماه حکومت‌داری خود کُشته‌ و یا ربوده‌اند.
نیویورک تایمز در این گزارش افزوده است که تمام ۴۹۰ مورد کُشته شدن و ناپدیدن شدن افغانان توسط طالبان را به‌گونه‌ جداگانه بررسی کرده و در تهیه‌ این گزارش با استفاده از انواع روش‌های راستی‌آزمایی به‌شمول انجام تحقیقات تصویری، طب قانونی، تأیید گزارش‌های خبری محلی، هم‌کاری با سازمان‌های حقوق بشری و مصاحبه با بازمانده‌گان و عضوهای خانواده قربانیان صورت گرفته است.
در این گزارش آمده است که طالبان پس از تسلط بر افغانستان نظامیان پیشین را پس از بازداشت شکنجه می‌کردند و سپس آنان را با ضرب گلوله یا سربُریدن می‌کُشتند.                           ",https://www.asriran.com/003VC0
834880,۱۴۰۱/۰۱/۲۴,فرهنگی/هنری,تقدیر از عکاس ایرانی در جشنواره سنگاپور,عکاسان ایرانی با آثار خود در دو جشنواره عکس لیون سنگاپور و حیات وحش لوگزامبورگ حضور یافتند.,"به گزارش روابط عمومی فیاپ در ایران، در جشنواره لیون که در سنگاپور برگزار شد، عکس ""در جستجوی نور"" از آرلن کشیشیان موفق به دریافت تقدیر PSS شد. 
 
در این جشنواره که زیر نظر فدراسیون بین المللی هنر عکاسی (فیاپ) و انجمن عکاسی آمریکا (PSA) برگزار شد، آثاری از عکاسان عضو کلوپ عکس فوکوس (نمایندگی فیاپ در ایران) شامل سید رضا جوادی، آرلن کشیشیان، مهدی زابل عباسی، میتراسادات امینی، علی سامعی، میرعلی پرندک و نادر شریفی پذیرفته شدند.
 
*حضور عکاسان ایرانی در جشنواره حیات وحش لوگزامبورگ
 
همچنین در جشنواره حیات وحش لوگزامبورگ که زیر نظر فدراسیون بین المللی هنر عکاسی (فیاپ) برگزار شد، آثاری از عکاسان عضو کلوپ عکس فوکوس (نمایندگی فیاپ در ایران) شامل سیدرضا جوادی، حمید احمدی بصیر، علی ثقفی، میرعلی پرندک و اویس غفاری پذیرفته شدند.
 
فدراسیون بین‌المللی هنر عکاسی (فیاپ) که به عنوان تنها مؤسسه بین‌المللی در زمینه عکاسی از طرف یونسکو به رسمیت شناخته شده است، در سال ۱۹۴۶ پایه‌گذاری شد و از آن سال تاکنون واسطه‌ای برای برقراری ارتباط بین مؤسسات ملی عکاسی در کشورهای مختلف جهان بوده است.
 
این فدراسیون به عنوان عضو اجرایی با مؤسسات ملی عکاسی در سراسر جهان همکاری نزدیک دارد که تعداد آنها به بیش از ۹۰ مؤسسه ملی در ۵ قاره می‌رسد. فیاپ در هر کشور تنها یک دفتر دارد که نماینده رسمی فیاپ در ایران «کلوپ عکس فوکوس» است.                           ",https://www.asriran.com/003VBo
834891,۱۴۰۱/۰۱/۲۴,اجتماعی ,توضیحات محیط زیست درباره تخلفات بهره‌برداری از کوه «بی‌بی شهربانو»,طبق گزارش‌های دریافتی و اطلاعاتی که از سوی اداره صنعت و معدن دریافت شده، برداشت از این کوه در چارچوب ضوابط زیست‌محیطی قید شده در مجوز فعالیت این معدن بوده است.,"ایسنا نوشت: به دنبال انتقاد رییس کمیته شفافیت و شهر هوشمند شورای اسلامی شهر تهران از میزان بهره برداری کارخانه سیمان تهران از کوه «بی بی شهربانو» در شهرستان ری، رییس اداره محیط زیست این شهرستان گفت: تاکنون گزارشی مبنی بر تخلف این مرکز به دست ما نرسیده و برداشت از این کوه طبق مجوز دریافتی است.
۲۳ فروردین ماه ۱۴۰۱ احمد صادقی - رییس کمیته شفافیت و شهر هوشمند شورای اسلامی شهر تهران - با انتقاد از برداشت بی‌رویه کارخانه سیمان از کوه‌های بی بی شهر بانو گفته بود: برداشت بی‌رویه از منابع طبیعی این کوه‌ها موجب بروز حوادث و بحران‌های احتمالی آینده خواهد شد و سازمان پیشگیری و مدیریت بحران و اداره کل محیط زیست شهرداری تهران می‌بایست در این زمینه گزارشی تهیه کنند.
در حالی این اظهارات مطرح شده است که علیرضا فاضلی ثانی - رییس اداره حفاظت محیط زیست شهرستان ری - می‌گوید: طبق گزارش‌های دریافتی و اطلاعاتی که از سوی اداره صنعت و معدن دریافت شده، برداشت از این کوه در چارچوب ضوابط زیست‌محیطی قید شده در مجوز فعالیت این معدن بوده است.
وی با اشاره به وظیفه اداره صنعت و معدن برای ثبت و پایش فعالیت‌های کارخانه سیمان و برداشت آن از کوه بی بی شهربانو اظهار می‌کند: استحصال و بهره‌برداری از معادن از منابع روندی دارد که یکی از آن‌ها اخذ مجوز محیط زیست است. اداره صنعت و معدن در زمان صدور مجوز میزان برداشت، استحصال و استفاده از منابع را در پروانه ذکر می‌کند و این برداشت به‌طور مداوم چک می‌شود. چک کردن منظم میزان برداشت، جزو وظایف اداره صنعت و معدن است و محیط زیست تنها در زمان صدور پروانه استقرار باید نقش خود را ایفا کند.
رییس اداره حفاظت محیط زیست شهرستان ری خاطرنشان می‌کند: مرجع نظارت بر فعالیت معادن اداره صنعت و معدن است. در واقع بیشتر فعالیت‌های انسانی از جمله احداث معدن به منزله آسیب به محیط زیست است. با این حال این موضوع نمی‌تواند دلیلی کافی برای جلوگیری از فعالیت معادن باشد و ما در محیط زیست وظیفه داریم ضابطه‌ای برای به حداقل رساندن آسیب‌های زیست‌محیطی تدوین کنیم.
فاضلی در ادامه می‌گوید: طبق گزارشات دریافتی، برداشت این معدن از منابع کوه بی بی شهربانو از چارچوب ضوابط ما خارج نشده است. مجوز این معدن دو سه دهه پیش صادر شده است. در صورتی که این برداشت بیش از حد شود، اداره صنعت و معدن می‌تواند اعلام جرم کند تا محیط زیست وارد عمل شود. بدیهی است که اداره صنعت و معدن نیز چنین کاری نمی‌کند.
رییس اداره محیط زیست شهرستان ری در پایان اظهار می‌کند: معادن سیمان در جریان فعالیت روزانه خود و برداشت سنگ از انفجار استفاده می‌کنند. این انفجار می‌تواند برای محیط زیست آلاینده باشد لذا سعی می‌کنیم روزانه یا ماهانه این انفجارها را چک یا رصد کنیم تا قدرت تخریبی آن‌ها حداقلی باشد و شعاع کمتری را آلوده کند.                           ",https://www.asriran.com/003VBz
